date,headline,ticker,source,sentiment_label,compound
2026-07-10 14:03:44,KeyBanc raises Alphabet stock price target on cloud strength - Investing.com,GOOGL,Google RSS,neutral,0.0
2026-07-12 12:00:00,The 3 Top Chip Stocks Investors Own on Robinhood - The Motley Fool,GOOGL,Google RSS,neutral,0.0
2026-07-09 08:30:36,GOOGL (Alphabet Inc.) Rides Strong Growth and a Tight Technical Setup for a Potential Breakout - ChartMill,GOOGL,Google RSS,positive,0.7759990096092224
2026-07-10 21:38:43,Alphabet stock tests key resistance zone signaling potential bullish trend reversal. - Pluang,GOOGL,Google RSS,negative,-0.4135361909866333
2026-07-12 02:31:04,"Amazon.com (AMZN) Sells Fresh Bonds, Is The Stock Still Cheap? - simplywall.st",AMZN,Google RSS,neutral,0.0
2026-07-07 21:29:00,Amazon Stocks Climbs As AI Push Drives $25 Billion Bond Sale - Investor's Business Daily,AMZN,Google RSS,neutral,0.0
2026-07-06 21:01:15,"Amid Strong, Positive Catalysts and the Endorsement of Goldman Sachs, Amazon Stock Looks Very Attractive - Barchart.com",AMZN,Google RSS,positive,0.8514057397842407
2026-07-07 20:13:00,"Samsung Fails to Impress, Amazon Issues AI Bonds and Oil Jumps | Markets P.M. for July 7 - WSJ",AMZN,Google RSS,neutral,0.0
2026-07-12 04:17:19,Microsoft Stock Is Falling but AI Spending Still Points to Long Term Upside - simplywall.st,MSFT,Google RSS,negative,-0.9159258008003236
2026-07-11 20:20:00,5 Top AI Stocks Investors Own on Robinhood,MSFT,Yahoo RSS,neutral,0.0
2026-07-08 18:19:39,Few bright spots in Wednesday's tough market — why Nvidia stock is one of them - CNBC,NVDA,Google RSS,neutral,0.0
2026-07-08 20:45:00,"Nvidia, Chip Stocks Rally Despite U.S.-Iran War Flare-Up - Investor's Business Daily",NVDA,Google RSS,neutral,0.0
2026-07-10 13:29:18,Morgan Stanley reiterates Overweight on Nvidia stock citing diversified growth - Investing.com,NVDA,Google RSS,neutral,0.0
2026-07-07 18:03:00,Jim Cramer sends strong signal to Nvidia stock investors amid rumors - thestreet.com,NVDA,Google RSS,positive,0.7141926288604736
2026-07-10 12:39:21,Nvidia Stock's Falling. Blame Meta. -- Barrons.com - Moomoo,NVDA,Google RSS,negative,-0.8964473009109497
2026-07-12 23:51:19,"Dow Jones Futures Fall, Oil Prices Rise Amid New U.S.-Iran Attacks; Nvidia, Micron, Sandisk Near Buy Points",NVDA,Yahoo RSS,negative,-0.8856472373008728
2026-07-09 20:58:00,Meta’s stock rebounds as agentic AI coding and custom chips ease spending fears - MarketWatch,META,Google RSS,negative,-0.6729409694671631
2026-07-11 05:53:25,"Meta stock surges on AI cost breakthrough, easing spending fears - eciks.org",META,Google RSS,positive,0.6406391859054565
2026-07-10 18:32:54,Meta stock jumps on AI model pricing and cloud plans - MSN,META,Google RSS,negative,-0.6252493858337402
2026-07-06 18:17:00,"Meta Stock Surged 9% to $612.91 on July 1 After Reports That Mark Zuckerberg Is Building a Cloud Business to Compete With Amazon, Microsoft, and Alphabet - The Motley Fool",META,Google RSS,positive,0.9462510347366332
2026-07-11 05:30:00,CoreWeave stock sank 11% after Mark Zuckerberg's Meta unveiled a cloud business plan,META,Bing RSS,negative,-0.9661747217178344
2026-07-12 11:06:54,Nomura Says AI Memory Demand Concerns Are Overdone as Supply Constraints Persist,META,Yahoo RSS,negative,-0.9575119614601136
2026-07-12 14:34:52,"‘Much Ado About Nothing,’ Says Top Investor About Netflix Stock - TipRanks",NFLX,Google RSS,neutral,0.0
2026-07-08 01:00:00,Netflix Stock Is Down 42% From Its High With Earnings Due July 16. Is It a Buy Before the Report? - The Motley Fool,NFLX,Google RSS,negative,-0.9589993357658386
2026-07-08 00:20:00,Netflix Stock Is Down 42% From Its High With Earnings Due July 16. Is It a Buy Before the Report? - The Globe and Mail,NFLX,Google RSS,negative,-0.9645596146583556
2026-07-10 20:01:17,"US Equity Markets End Higher Amid Broad Rally, US-Iran Diplomatic Progress",NFLX,Yahoo RSS,positive,0.9307498335838318
2026-07-10 19:46:37,Sector Update: Consumer Stocks Rise Late Afternoon,NFLX,Yahoo RSS,positive,0.7561094760894775
2026-07-10 13:31:10,"U.S. Futures Drift as Investors Await Earnings Season and Inflation Data: Dow Jones, S&P, Nasdaq",NFLX,Yahoo RSS,neutral,0.0
2026-07-12 16:54:43,"Why Retail Traders Couldn’t Take Their Eyes Off These Stocks Last Week: AAPL, MU, MSFT, META, BABA - Stocktwits",AAPL,Google RSS,neutral,0.0
2026-07-13 01:49:33,"Why Retail Traders Couldn’t Take Their Eyes Off These Stocks Last Week: AAPL, MU, MSFT, META, BABA",AAPL,Yahoo RSS,neutral,0.0
2026-07-12 13:36:35,"‘Opportunity is Knocking,’ Says Top Investor About Amazon Stock - TipRanks",AMZN,Google RSS,neutral,0.0
2026-07-12 16:54:43,"Why Retail Traders Couldn’t Take Their Eyes Off These Stocks Last Week: AAPL, MU, MSFT, META, BABA - Stocktwits",MSFT,Google RSS,neutral,0.0
2026-07-13 01:49:33,"Why Retail Traders Couldn’t Take Their Eyes Off These Stocks Last Week: AAPL, MU, MSFT, META, BABA",MSFT,Yahoo RSS,neutral,0.0
2026-07-13 03:11:00,"Dow Jones Futures Fall, Oil Prices Rise Amid New U.S.-Iran Attacks; Nvidia, Micron, Sandisk Near Buy Points - Investor's Business Daily",NVDA,Google RSS,negative,-0.6970627307891846
2026-07-13 01:33:57,"Nasdaq, S&P 500, Dow Futures Fall After Trump Directs Strikes ‘To Hold Iranian Forces Accountable’: NVDA, SLS, MRK, SKHYV, QS Stocks In Focus",NVDA,Yahoo RSS,negative,-0.7205125689506531
2026-07-13 01:49:00,"Why Retail Traders Couldn’t Take Their Eyes Off These Stocks Last Week: AAPL, MU, MSFT, META, BABA - TradingView",AAPL,Google RSS,neutral,0.0
2026-07-13 01:49:00,"Why Retail Traders Couldn’t Take Their Eyes Off These Stocks Last Week: AAPL, MU, MSFT, META, BABA - TradingView",MSFT,Google RSS,neutral,0.0
2026-07-13 10:42:27,Apple gains $600B as traders flee AI selloff - Crypto Briefing,AAPL,Google RSS,negative,-0.801583468914032
2026-07-13 11:32:50,Alphabet stock edges higher as investors await fresh AI clues - ad-hoc-news.de,GOOGL,Google RSS,positive,0.5983676910400391
2026-07-13 09:09:57,ORCL Eyes 52-Week Low After Sharp Slide: Retail Traders Say Stock Is 'Ridiculously Undervalued',MSFT,Yahoo RSS,negative,-0.9684041142463684
2026-07-13 10:44:00,"If the Fed Hikes Interest Rates in 2026, History Says This Is the Best Move Investors Can Make Now",NVDA,Yahoo RSS,neutral,0.0
2026-07-13 12:49:34,Global smartphone shipments in second quarter hit lowest in 13 years on memory chip crunch,AAPL,Yahoo RSS,negative,-0.9659157395362854
2026-07-13 13:51:00,Tesla Stock Is Falling. Can Robots Arrive Soon Enough to Save It?,GOOGL,Yahoo RSS,negative,-0.8994364738464355
2026-07-13 12:38:13,Why Is NVIDIA Stock Falling Monday? - Benzinga,NVDA,Google RSS,negative,-0.9250187277793884
2026-07-13 13:51:00,Tesla Stock Is Falling. Can Robots Arrive Soon Enough to Save It? - Barron's,TSLA,Google RSS,negative,-0.8828741908073425
2026-07-13 13:51:00,Tesla Stock Is Falling. Can Robots Arrive Soon Enough to Save It?,TSLA,Yahoo RSS,negative,-0.8994364738464355
2026-07-13 12:00:00,Apex Fintech Solutions Releases Q2 2026 Investor Pulse Report: SpaceX IPO Draws Universal Demand as Retail Rotates Into the AI Buildout,TSLA,Yahoo RSS,positive,0.9017674922943116
2026-07-13 17:09:41,Apple (AAPL) Reaches New All-Time High Amid Strong Sales and AI Optimism - GuruFocus,AAPL,Google RSS,positive,0.9387185573577881
2026-07-13 15:53:46,Apple's record rally puts these ETFs with the biggest exposure in focus (AAPL:NASDAQ) - Seeking Alpha,AAPL,Google RSS,neutral,0.0
2026-07-13 17:15:30,Apple hits record high as Wall Street sees demand surviving price increases - Crypto Briefing,AAPL,Google RSS,positive,0.7748016715049744
2026-07-13 10:31:00,Apple’s $650 billion rally fueled by traders fleeing AI selloff,AAPL,Bing RSS,negative,-0.903901994228363
2026-07-13 17:18:05,TSMC Reports 36% Sales Growth as AI Demand Stays Strong,AAPL,Yahoo RSS,positive,0.9526655673980713
2026-07-13 16:49:00,"AI Costs Keep Rising As Morgan Stanley Ups CapEx Estimates For Amazon, Meta - Investor's Business Daily",AMZN,Google RSS,positive,0.47307923436164856
2026-07-13 07:30:59,"Dear Microsoft stock fans, mark your calendars for July 13",MSFT,Bing RSS,neutral,0.0
2026-07-13 17:18:05,TSMC Reports 36% Sales Growth as AI Demand Stays Strong,NVDA,Yahoo RSS,positive,0.9526655673980713
2026-07-13 16:49:00,"AI Costs Keep Rising As Morgan Stanley Ups CapEx Estimates For Amazon, Meta - Investor's Business Daily",META,Google RSS,positive,0.47307923436164856
2026-07-13 17:18:05,TSMC Reports 36% Sales Growth as AI Demand Stays Strong,META,Yahoo RSS,positive,0.9526655673980713
2026-07-13 16:44:36,Traders are betting on a comeback quarter for Netflix - CNBC,NFLX,Google RSS,neutral,0.0
2026-07-13 13:00:02,"Netflix Stock is at New Lows, But Its FCF Is Strong - Is NFLX Too Cheap? - Barchart.com",NFLX,Google RSS,negative,-0.6692575216293335
