date,headline,ticker,source,sentiment_label,compound
2026-05-14 11:09:23,Apple Stock Hits Record Peak as iPhone Demand Stays Strong - TradingView,AAPL,Google RSS,positive,0.9029651880264282
2026-05-13 18:34:39,Apple stock on track for record close as tech rebounds - MSN,AAPL,Google RSS,positive,0.7252614498138428
2026-05-15 10:20:02,Alphabet Stock holds above $400 as overbought signals warn of a pause - The Cryptonomist,GOOGL,Google RSS,negative,-0.8081930875778198
2026-05-14 22:38:39,"‘Start Small,’ Says Top Investor About Alphabet Stock - TipRanks",GOOGL,Google RSS,neutral,0.0
2026-05-15 18:35:37,"Equities Fall, Yields Surge Intraday Amid Inflation Concerns; Oil Jumps",GOOGL,Yahoo RSS,negative,-0.8796101212501526
2026-05-15 14:46:13,"Why is US stock market falling today? Dow Jones, S&P 500 and Nasdaq crash after Trump concludes China visi - The Economic Times",AMZN,Google RSS,negative,-0.5612699389457703
2026-05-14 23:35:00,3 Top Stocks That Growth Investors Should Buy Now - The Motley Fool,AMZN,Google RSS,neutral,0.0
2026-05-14 15:10:30,Microsoft stock ticks up amid continued trading below long- and short-term averages - Traders Union,MSFT,Google RSS,positive,0.9190012216567992
2026-05-14 14:05:15,Microsoft stock price forecast: $390.00 support as MSFT trades flat - Traders Union,MSFT,Google RSS,neutral,0.0
2026-05-15 15:24:13,Microsoft Retail Traders Build Bullish Positions After Ackman Takes Stake: Options Chatter - Moomoo,MSFT,Google RSS,neutral,0.0
2026-05-13 17:07:03,"‘Don’t Miss It,’ Says Top Investor About Microsoft Stock - TipRanks",MSFT,Google RSS,neutral,0.0
2026-05-12 14:56:14,Microsoft stock trades flat as Q3 2026 earnings beat analyst expectations - Traders Union,MSFT,Google RSS,negative,-0.9563884139060974
2026-05-15 18:35:37,"Equities Fall, Yields Surge Intraday Amid Inflation Concerns; Oil Jumps",MSFT,Yahoo RSS,negative,-0.8796101212501526
2026-05-15 20:32:00,"Stock Market Today: Dow Loses 500 Points As Yields, Oil Rally; Nvidia Falls (Live Coverage) - Investor's Business Daily",NVDA,Google RSS,negative,-0.8993037343025208
2026-05-15 15:14:00,Nvidia Stock Powers Higher As AI Growth Accelerates; Earnings Loom Large - Investor's Business Daily,NVDA,Google RSS,positive,0.826762855052948
2026-05-14 14:24:16,Cantor Fitzgerald raises Nvidia stock price target on earnings outlook - Investing.com,NVDA,Google RSS,neutral,0.0
2026-05-13 20:39:00,Nvidia stock hits an all-time high on new AI bullishness from Wall Street analysts - Business Insider,NVDA,Google RSS,positive,0.9140953421592712
2026-05-15 11:17:00,"Dow Jones: Guess Which Stock Drove The Dow To 50,000? (It's Not Nvidia) - Investor's Business Daily",NVDA,Google RSS,neutral,0.0
2026-05-15 21:39:22,"Nvidia, retailer reports to shed light on AI boom, consumer spending By Reuters - Investing.com",NVDA,Google RSS,neutral,0.0
2026-05-15 12:18:00,"Dow Jones Futures Fall As Yields Top 4.5%, Oil Prices Jump On Trump; Xi Summit Ends - Investor's Business Daily",NVDA,Google RSS,negative,-0.8429572582244873
2026-05-13 10:20:00,Nvidia stock hits an all-time high on new AI bullishness from Wall Street analysts,NVDA,Bing RSS,positive,0.9205371141433716
2026-05-15 13:06:00,"Stock market today: Dow, S&P 500, Nasdaq sink as bond yields jump to cap volatile week ahead of Nvidia earnings",NVDA,Bing RSS,negative,-0.8302368521690369
2026-05-15 20:51:55,"Dow Jones Futures: S&P 500, Nasdaq Hold Near Highs; Nvidia, Walmart Earnings Loom",NVDA,Yahoo RSS,positive,0.5851449966430664
2026-05-14 18:17:30,Tesla stock trades flat after rising U.S. Treasury yields cap gains - Traders Union,TSLA,Google RSS,negative,-0.9233168959617616
2026-05-14 15:51:00,Panasonic Raises EV Battery Outlook Based On Tesla's Sales Bounce - Investor's Business Daily,TSLA,Google RSS,neutral,0.0
2026-05-15 05:13:16,Tesla stock (US88160R1014): earnings slide and price cuts keep investors on edge - AD HOC NEWS,TSLA,Google RSS,negative,-0.9556364417076112
2026-05-13 01:26:28,Tesla stock downgraded from Strong Buy Candidate to Hold/Accumulate after Tuesday trading session - StockInvest.us,TSLA,Google RSS,negative,-0.7165365219116211
2026-05-15 13:14:14,"Exchange-Traded Funds, Equity Futures Lower Pre-Bell Friday Amid Oil Surge, Higher Yields, Geopolitical Uncertainty",TSLA,Yahoo RSS,negative,-0.8922029137611389
2026-05-15 12:26:00,UBS warns AI stocks are overheating as growth expectations collide with history,TSLA,Yahoo RSS,negative,-0.962759494781494
2026-05-14 23:35:00,3 Top Stocks That Growth Investors Should Buy Now - The Motley Fool,META,Google RSS,neutral,0.0
2026-05-15 18:45:11,"Stocks making the biggest moves midday: Cerebras, Microsoft, ServiceNow, Papa John's & more",MSFT,CNBC Finance,neutral,0.0
2026-05-16 00:45:59,Stronger technical forecast for Apple stock price after Friday trading - StockInvest.us,AAPL,Google RSS,positive,0.715233564376831
2026-05-14 00:55:06,Stronger technical forecast for Apple stock price after Wednesday trading - StockInvest.us,AAPL,Google RSS,positive,0.7186022400856018
2026-05-13 19:03:00,The Best AI Infrastructure Stocks for Growth Investors to Buy in 2026 - The Motley Fool,AMZN,Google RSS,neutral,0.0
2026-05-15 15:51:20,"Stocks making the biggest moves midday: Cerebras, Microsoft, ServiceNow, Papa John's & more - CNBC",MSFT,Google RSS,neutral,0.0
2026-05-15 20:34:02,Stocks Settle Sharply Lower as Bond Yields Jump on Inflation Fears,MSFT,Yahoo RSS,negative,-0.939234972000122
2026-05-16 02:57:00,"Dow Jones Futures: S&P 500, Nasdaq Hold Near Highs; Nvidia, Walmart Earnings Loom - Investor's Business Daily",NVDA,Google RSS,neutral,0.0
2026-05-14 23:35:00,3 Top Stocks That Growth Investors Should Buy Now - The Motley Fool,NVDA,Google RSS,neutral,0.0
2026-05-14 02:11:15,Meta's stock shows bullish call option activity and undervalued volatility after Q1 earnings. - Pluang,META,Google RSS,negative,-0.4683497250080108
2026-05-12 22:02:46,"NVIDIA to release earnings May 20 as stock lags behind AMD, Intel - Fox Business",NVDA,Google RSS,negative,-0.8100184202194214
2026-05-14 22:02:30,Nvidia Will Report Earnings on May 20 — What Top Financial Analysts Expect From It - TipRanks,NVDA,Google RSS,neutral,0.0
2026-05-16 08:56:52,Nicholson Meyer Capital Management Inc. Reduces Stock Position in NVIDIA Corporation $NVDA - MarketBeat,NVDA,Google RSS,negative,-0.9549171328544616
2026-05-16 10:56:00,"Yikes! The Federal Reserve's May Inflation Forecast Is In, and It Has Big Implications for Social Security's 2027 COLA.",NVDA,Yahoo RSS,negative,-0.6306694746017456
2026-05-16 12:30:34,Microsoft Corporation (NASDAQ:MSFT): A Strong Growth Stock with a Timely Technical Setup - ChartMill,MSFT,Google RSS,positive,0.8820297122001648
2026-05-16 13:31:12,"Stocks like Nvidia have accelerating 'momentum,' Goldman Sachs says - CNBC",NVDA,Google RSS,positive,0.8612191081047058
2026-05-16 12:16:03,"Dow Jones Futures: S&P 500, Nasdaq Still Near Highs As Nvidia, Walmart Earnings Loom",NVDA,Yahoo RSS,positive,0.7032518982887268
2026-05-16 11:48:44,Assessing Whether Tesla (TSLA) Still Looks Undervalued After Recent Share Price Pullback - simplywall.st,TSLA,Google RSS,neutral,0.0
2026-05-16 13:20:42,"Meta Platforms, Inc. stock (US30303M1027): Analyst downgrade tests confidence after strong earnings - AD HOC NEWS",META,Google RSS,negative,-0.9688569903373718
2026-05-15 04:25:55,Microsoft stock slides after earnings: What overshadowed strong cloud growth - MSN,MSFT,Google RSS,negative,-0.841106116771698
