date,headline,ticker,source,sentiment_label,compound
2026-04-27 14:36:12,AAPL stock edges lower amid leadership transition and upcoming earnings: weekly analysis - Traders Union,AAPL,Google RSS,negative,-0.93744558095932
2026-04-28 09:11:54,Personal CFO Solutions LLC Increases Stake in Apple Inc. $AAPL - MarketBeat,AAPL,Google RSS,positive,0.6387836933135986
2026-04-28 18:15:08,The Easy Money Has Been Made In Big Tech Stocks. Will This Week's Earnings Be 'Good Enough' for Investors?,AAPL,Yahoo RSS,neutral,0.0
2026-04-28 17:24:00,Alphabet Flashes Strength As OpenAI Growth Concerns Sink Tech Stocks; Earnings Ahead - Investor's Business Daily,GOOGL,Google RSS,positive,0.567026674747467
2026-04-26 21:00:00,"Wall Street’s Super Bowl Wednesday: Alphabet, Amazon, Microsoft and Meta report along with Powell’s last Fed meeting - MarketWatch",GOOGL,Google RSS,neutral,0.0
2026-04-28 02:13:00,"Dow Jones Futures: Nasdaq, S&P 500 Set More Record Highs; Micron, Nvidia, Sandisk, Alphabet Are Big Winners - Investor's Business Daily",GOOGL,Google RSS,neutral,0.0
2026-04-27 04:09:17,Alphabet stock climbs as Anthropic investment tranche lifts sentiment - Traders Union,GOOGL,Google RSS,positive,0.7843586802482605
2026-04-28 18:12:45,Alphabet flashes strength as OpenAI growth concerns sink tech stocks; earnings ahead - MSN,GOOGL,Google RSS,positive,0.6637100577354431
2026-04-27 13:56:44,Amazon Is About to Report Q1 Earnings. Do Options Traders Expect a Major Move in AMZN Stock? - TipRanks,AMZN,Google RSS,neutral,0.0
2026-04-28 21:35:00,Amazon Is About to Report Q1 Earnings. Do Options Traders Expect a Major Move in AMZN Stock?,AMZN,Yahoo RSS,neutral,0.0
2026-04-27 11:14:27,Home Page - Microsoft Investor Relations - Microsoft,MSFT,Google RSS,neutral,0.0
2026-04-25 20:44:37,Morgan Stanley resets Microsoft stock forecast ahead of earnings - thestreet.com,MSFT,Google RSS,neutral,0.0
2026-04-28 14:08:51,Benchmark reiterates Buy rating on Microsoft stock ahead of earnings - Investing.com,MSFT,Google RSS,neutral,0.0
2026-04-24 07:00:00,Should You Buy Microsoft Stock Before the Huge Investor Update? - The Motley Fool,MSFT,Google RSS,neutral,0.0
2026-04-28 14:06:19,Microsoft stock trades in upper recent range as RSI signals a bearish tone: weekly report - Traders Union,MSFT,Google RSS,negative,-0.4690907895565033
2026-04-22 12:00:00,Microsoft Higher Ahead Of Magnificent Seven Earnings; Is Microsoft A Buy Now? - Investor's Business Daily,MSFT,Google RSS,positive,0.6000243425369263
2026-04-28 08:56:31,Microsoft Q3 Earnings Preview — Can Strong Results Restart the MSFT Stock Rally? - The Globe and Mail,MSFT,Google RSS,neutral,0.0
2026-04-29 00:29:15,The MSFT Stock Stalls Despite Higher Revenue Expectations – Microsoft Earnings Preview - FXLeaders,MSFT,Google RSS,negative,-0.9340072870254515
2026-04-28 15:38:54,"Microsoft (MSFT) Stock Has Been Lagging Big Tech – But a Turnaround May Be Near, Say Analysts - TipRanks",MSFT,Google RSS,positive,0.7711024284362793
2026-04-28 11:04:46,Microsoft Will Report Q3 Earnings Tomorrow. Options Traders Expect a 7% Move in MSFT Stock - TipRanks,MSFT,Google RSS,positive,0.8766162991523743
2026-04-28 20:00:00,"[Latest] Global Generative AI in Chemical Market Size/Share Worth USD 12.84 Billion by 2035 at a 24.9% CAGR: Custom Market Insights (Analysis, Outlook, Leaders, Report, Trends, Forecast, Segmentation, Growth Rate, Value, SWOT Analysis)",MSFT,Yahoo RSS,neutral,0.0
2026-04-28 19:53:13,"US Equity Indexes Decline Amid Sharp Sell-Off in Semiconductors, Rising Crude Oil",MSFT,Yahoo RSS,negative,-0.9646106362342834
2026-04-28 19:06:52,Traders bet Nvidia's stock will return to record highs soon - CNBC,NVDA,Google RSS,positive,0.4868192374706268
2026-04-27 16:52:05,Nvidia stock hits new all-time high amid market cap speculation - Crypto Briefing,NVDA,Google RSS,positive,0.5358685255050659
2026-04-28 14:18:44,Nvidia stock slides as OpenAI fears spark selloff in chip stocks - TradingView,NVDA,Google RSS,negative,-0.9546524286270142
2026-04-28 14:49:20,Nvidia stock drops 3.24% as price hovers close to session lows - Traders Union,NVDA,Google RSS,negative,-0.963884174823761
2026-04-28 14:27:22,Nvidia stock gains as price holds well above key moving averages: weekly outlook - Traders Union,NVDA,Google RSS,positive,0.7894113659858704
2026-04-28 18:39:00,"Dow Jones AI Leader Caterpillar, Nvidia Chipmaker TSMC In Buy Zones - Investor's Business Daily",NVDA,Google RSS,neutral,0.0
2026-04-28 02:13:00,"Dow Jones Futures: Nasdaq, S&P 500 Set More Record Highs; Micron, Nvidia, Sandisk, Alphabet Are Big Winners - Investor's Business Daily",NVDA,Google RSS,neutral,0.0
2026-04-28 12:06:52,Traders bet Nvidia's stock will return to record highs soon,NVDA,Bing RSS,positive,0.9437516331672668
2026-04-28 22:39:21,"Nasdaq, S&P 500 end lower on renewed AI growth worries",NVDA,Yahoo RSS,negative,-0.959394097328186
2026-04-23 20:03:00,Why Tesla Stock Is Falling - Investor's Business Daily,TSLA,Google RSS,neutral,0.0
2026-04-25 22:59:17,"Why Is Tesla Stock Falling, and is it a Buying Opportunity? - The Motley Fool",TSLA,Google RSS,negative,-0.7679591178894043
2026-04-27 13:25:00,Tesla Just Unlocked A Massive Share Pool As Musk Pay Shares Get Registered – Retail Traders Flag Potential Sell Pressure - Stocktwits,TSLA,Google RSS,neutral,0.0
2026-04-27 11:43:32,Cantor Fitzgerald reiterates Tesla stock Overweight on strong quarter - Investing.com,TSLA,Google RSS,negative,-0.6764784455299377
2026-04-28 08:20:40,META Platforms (NASDAQ:META) Screens as Strong Growth Stock with Bull Flag Technical Setup - ChartMill,META,Google RSS,positive,0.7995240092277527
2026-04-27 02:18:12,Meta stock climbs as Pursuit Wealth Management LLC equity purchase boosts sentiment - Traders Union,META,Google RSS,positive,0.8990601897239685
2026-04-29 01:30:00,Meta Stock Hits $680: Strong Growth Pushes Tech Giant Higher - Analytics Insight,META,Google RSS,positive,0.933047354221344
2026-04-27 09:35:00,Buckle up: JPMorgan warns the stock market is headed for a volatile earnings week - Business Insider,META,Google RSS,negative,-0.9570503830909728
2026-04-28 11:28:00,Wall Street is eyeing a new burst of growth for Meta ahead of its Q1 earnings report,META,Bing RSS,positive,0.9359608292579652
2026-04-28 18:45:00,Meta Stock Hits $680: Strong Growth Pushes Tech Giant Higher,META,Bing RSS,positive,0.9318361282348632
2026-04-28 21:35:00,Amazon Is About to Report Q1 Earnings. Do Options Traders Expect a Major Move in AMZN Stock?,META,Yahoo RSS,neutral,0.0
2026-04-27 12:44:00,Goldman Sachs resets Apple stock forecast before earnings - thestreet.com,AAPL,Google RSS,neutral,0.0
2026-04-28 06:55:14,3 Apple Supply Chain Stocks Before AAPL Q2 Earnings - Gotrade,AAPL,Google RSS,neutral,0.0
2026-04-27 12:49:23,Veteran analyst revamps Alphabet stock price target ahead of earnings - TradingView,GOOGL,Google RSS,neutral,0.0
2026-04-27 22:30:14,Overnight U.S. Stocks | S&P 500 and Nasdaq Reach New Highs; NVIDIA (NVDA.US) Surges 4% to Hit Record High - Moomoo,NVDA,Google RSS,positive,0.9072206020355223
2026-04-27 22:00:18,Intel Vs. Nvidia Stock: Which Semiconductor Is Up More Since They Swapped Places In Dow Jones Industrial Average? - Benzinga,NVDA,Google RSS,positive,0.5491539835929871
2026-04-28 13:32:00,Tesla stock is stuck in neutral. Good news from NHTSA isn’t helping.,TSLA,Bing RSS,negative,-0.927598476409912
2026-04-27 18:50:48,Amazon Just Signed a Major Deal to Supply Its In-House Chips to Meta Platforms. AMZN Stock Now Has Multiple AI Chip Catalysts.,AMZN,Yahoo Global,neutral,0.0
2026-04-27 18:50:48,Amazon Just Signed a Major Deal to Supply Its In-House Chips to Meta Platforms. AMZN Stock Now Has Multiple AI Chip Catalysts.,META,Yahoo Global,neutral,0.0
2026-04-27 21:22:00,"Alphabet earnings on tap with Gemini, AI spending updates in focus with stock near record high",GOOGL,Bing RSS,positive,0.915263295173645
2026-04-28 23:14:05,"Stock market today: S&P 500, Nasdaq, Dow futures inch up ahead of Mag 7 earnings, last Powell term meeting",GOOGL,Yahoo RSS,positive,0.920294225215912
2026-04-28 23:14:05,"Stock market today: S&P 500, Nasdaq, Dow futures inch up ahead of Mag 7 earnings, last Powell term meeting",AMZN,Yahoo RSS,positive,0.920294225215912
2026-04-29 08:00:17,"DDD Partners LLC Purchases 5,316 Shares of Microsoft Corporation $MSFT - MarketBeat",MSFT,Google RSS,neutral,0.0
2026-04-28 23:14:05,"Stock market today: S&P 500, Nasdaq, Dow futures inch up ahead of Mag 7 earnings, last Powell term meeting",MSFT,Yahoo RSS,positive,0.920294225215912
2026-04-28 23:14:05,"Stock market today: S&P 500, Nasdaq, Dow futures inch up ahead of Mag 7 earnings, last Powell term meeting",NVDA,Yahoo RSS,positive,0.920294225215912
2026-04-22 22:57:00,Tesla earnings recap: Company signals 'rebound of demand' and big capex spending increase - Business Insider,TSLA,Google RSS,positive,0.951324701309204
2026-04-27 11:31:12,The bullish signals ahead of this week's Mag-7 earnings - CNBC,META,Google RSS,neutral,0.0
2026-04-28 23:14:05,"Stock market today: S&P 500, Nasdaq, Dow futures inch up ahead of Mag 7 earnings, last Powell term meeting",META,Yahoo RSS,positive,0.920294225215912
2026-04-29 09:50:00,"The 4 most important numbers to watch as Alphabet, Microsoft, Amazon, and Meta report earnings - Business Insider",GOOGL,Google RSS,neutral,0.0
2026-04-29 09:33:03,"Networth Advisors LLC Invests $632,000 in Microsoft Corporation $MSFT - MarketBeat",MSFT,Google RSS,neutral,0.0
2026-04-29 09:33:06,"FSC Wealth Advisors LLC Sells 2,946 Shares of Microsoft Corporation $MSFT - MarketBeat",MSFT,Google RSS,neutral,0.0
2026-04-29 10:53:59,Nvidia (NVDA) Stock; Edges Lower as New Nanya Supply Pact Expands AI Chip Ecosystem - CoinCentral,NVDA,Google RSS,positive,0.5481973886489868
2026-04-28 07:21:00,Nvidia stock slides as OpenAI fears spark selloff in chip stocks,NVDA,Bing RSS,negative,-0.9566072821617126
2026-04-29 09:10:08,Taiwan's ASE expects strong demand to boost advanced chip packaging sales in 2026,NVDA,Yahoo RSS,positive,0.9511339664459229
2026-04-25 13:15:01,"Meta Platforms Will Close 6,000 Open Positions in Addition to Major Layoffs as META Stock Investors Worry That AI Spend Is Just Too Much - Barchart.com",META,Google RSS,negative,-0.9585912227630616
2026-04-29 10:00:20,US Has More Natural Gas Than It Can Use as War Chokes Global Supply,META,Yahoo RSS,negative,-0.8510112166404724
2026-04-29 13:44:42,"S&P 500 Holds Steady as Big Tech Earnings, Fed Decision and Oil Prices Collide",AAPL,Yahoo RSS,negative,-0.6950017213821411
2026-04-29 13:58:56,Microsoft earnings preview: The key to the Mag 7 tech rally,GOOGL,Yahoo RSS,neutral,0.0
2026-04-29 13:44:42,"S&P 500 Holds Steady as Big Tech Earnings, Fed Decision and Oil Prices Collide",GOOGL,Yahoo RSS,negative,-0.6950017213821411
2026-04-29 13:16:31,"Fed Decision Looms, Tech Earnings Could Drive Volatile Session: Dow Jones, S&P, Nasdaq, Wall Street Futures",GOOGL,Yahoo RSS,negative,-0.5072037577629089
2026-04-29 12:58:35,"US Equity Futures Largely Flat Pre-Bell as Traders Await Tech Earnings, Fed Rate Decision",GOOGL,Yahoo RSS,negative,-0.7453227639198303
2026-04-29 12:10:06,"US Equity Futures Largely Flat as Traders Await Tech Earnings, Fed Rate Decision",GOOGL,Yahoo RSS,negative,-0.780953049659729
2026-04-29 09:56:11,"The 4 most important numbers to watch as Alphabet, Microsoft, Amazon, and Meta report earnings - Business Insider",AMZN,Google RSS,neutral,0.0
2026-04-29 13:58:56,Microsoft earnings preview: The key to the Mag 7 tech rally,AMZN,Yahoo RSS,neutral,0.0
2026-04-29 13:44:42,"S&P 500 Holds Steady as Big Tech Earnings, Fed Decision and Oil Prices Collide",AMZN,Yahoo RSS,negative,-0.6950017213821411
2026-04-29 13:16:31,"Fed Decision Looms, Tech Earnings Could Drive Volatile Session: Dow Jones, S&P, Nasdaq, Wall Street Futures",AMZN,Yahoo RSS,negative,-0.5072037577629089
2026-04-29 12:58:35,"US Equity Futures Largely Flat Pre-Bell as Traders Await Tech Earnings, Fed Rate Decision",AMZN,Yahoo RSS,negative,-0.7453227639198303
2026-04-29 12:10:06,"US Equity Futures Largely Flat as Traders Await Tech Earnings, Fed Rate Decision",AMZN,Yahoo RSS,negative,-0.780953049659729
2026-04-29 09:56:11,"The 4 most important numbers to watch as Alphabet, Microsoft, Amazon, and Meta report earnings - Business Insider",MSFT,Google RSS,neutral,0.0
2026-04-29 10:56:00,MSFT Stock Is Down 12% YTD. Can Strong Azure Growth Turn It Around? - EBC Financial Group,MSFT,Google RSS,negative,-0.9578982591629028
2026-04-29 13:58:56,Microsoft earnings preview: The key to the Mag 7 tech rally,MSFT,Yahoo RSS,neutral,0.0
2026-04-29 13:44:42,"S&P 500 Holds Steady as Big Tech Earnings, Fed Decision and Oil Prices Collide",MSFT,Yahoo RSS,negative,-0.6950017213821411
2026-04-29 13:16:31,"Fed Decision Looms, Tech Earnings Could Drive Volatile Session: Dow Jones, S&P, Nasdaq, Wall Street Futures",MSFT,Yahoo RSS,negative,-0.5072037577629089
2026-04-29 12:58:35,"US Equity Futures Largely Flat Pre-Bell as Traders Await Tech Earnings, Fed Rate Decision",MSFT,Yahoo RSS,negative,-0.7453227639198303
2026-04-29 12:10:06,"US Equity Futures Largely Flat as Traders Await Tech Earnings, Fed Rate Decision",MSFT,Yahoo RSS,negative,-0.780953049659729
2026-04-29 13:44:42,"S&P 500 Holds Steady as Big Tech Earnings, Fed Decision and Oil Prices Collide",NVDA,Yahoo RSS,negative,-0.6950017213821411
2026-04-29 13:07:49,"Meta after the bell: Prediction markets flag Threads, AI, and cloud momentum - Seeking Alpha",META,Google RSS,neutral,0.0
2026-04-29 13:58:56,Microsoft earnings preview: The key to the Mag 7 tech rally,META,Yahoo RSS,neutral,0.0
2026-04-29 13:44:42,"S&P 500 Holds Steady as Big Tech Earnings, Fed Decision and Oil Prices Collide",META,Yahoo RSS,negative,-0.6950017213821411
2026-04-29 13:16:31,"Fed Decision Looms, Tech Earnings Could Drive Volatile Session: Dow Jones, S&P, Nasdaq, Wall Street Futures",META,Yahoo RSS,negative,-0.5072037577629089
2026-04-29 12:58:35,"US Equity Futures Largely Flat Pre-Bell as Traders Await Tech Earnings, Fed Rate Decision",META,Yahoo RSS,negative,-0.7453227639198303
2026-04-29 12:10:06,"US Equity Futures Largely Flat as Traders Await Tech Earnings, Fed Rate Decision",META,Yahoo RSS,negative,-0.780953049659729
2026-04-29 16:31:05,Apple's Q2 Earnings: Strong iPhone 17 Shipment to Aid Top-Line Growth - Zacks Investment Research,AAPL,Google RSS,positive,0.9335983395576477
2026-04-29 15:59:35,Qualcomm to report Q2 earnings as smartphone market faces steep declines,AAPL,Yahoo RSS,positive,0.5359708070755005
2026-04-29 14:54:05,VIX Climbs as Fed Decision and Mega-Cap Earnings Keep Investors on Edge,AAPL,Yahoo RSS,positive,0.695554256439209
2026-04-29 14:17:29,"Nasdaq Composite Treads Carefully Ahead of Big Tech Bonanza, Fed Decision",AAPL,Yahoo RSS,neutral,0.0
2026-04-29 16:00:01,"Alphabet first-quarter results likely to show continued growth, boosted by cloud - CNBC",GOOGL,Google RSS,positive,0.946622371673584
2026-04-29 15:28:29,"Alphabet investors push for safeguards on use of its cloud, AI tech By Reuters - Investing.com",GOOGL,Google RSS,neutral,0.0
2026-04-29 06:59:00,"Alphabet first-quarter results likely to show continued growth, boosted by cloud",GOOGL,Bing RSS,positive,0.9522730112075806
2026-04-29 15:59:35,Qualcomm to report Q2 earnings as smartphone market faces steep declines,GOOGL,Yahoo RSS,positive,0.5359708070755005
2026-04-29 15:23:41,"Alphabet investors push for safeguards on use of its cloud, AI tech",GOOGL,Yahoo RSS,neutral,0.0
2026-04-29 14:17:29,"Nasdaq Composite Treads Carefully Ahead of Big Tech Bonanza, Fed Decision",GOOGL,Yahoo RSS,neutral,0.0
2026-04-29 15:59:35,Qualcomm to report Q2 earnings as smartphone market faces steep declines,AMZN,Yahoo RSS,positive,0.5359708070755005
2026-04-29 14:54:05,VIX Climbs as Fed Decision and Mega-Cap Earnings Keep Investors on Edge,AMZN,Yahoo RSS,positive,0.695554256439209
2026-04-29 14:17:29,"Nasdaq Composite Treads Carefully Ahead of Big Tech Bonanza, Fed Decision",AMZN,Yahoo RSS,neutral,0.0
2026-04-29 16:00:01,Microsoft's earnings report lands after stock's worst quarterly performance since 2008 - CNBC,MSFT,Google RSS,negative,-0.9549155831336975
2026-04-29 14:49:12,Microsoft stock down 1% ahead of earnings: what to expect? - Invezz,MSFT,Google RSS,negative,-0.9472199082374573
2026-04-29 14:40:00,Analysts trim Microsoft-linked crypto stock's target despite AI push - thestreet.com,MSFT,Google RSS,negative,-0.8241593837738037
2026-04-29 06:59:00,Microsoft's earnings report lands after stock's worst quarterly performance since 2008,MSFT,Bing RSS,negative,-0.9720430374145508
2026-04-29 07:49:00,Microsoft stock down 1% ahead of earnings: what to expect?,MSFT,Bing RSS,negative,-0.9511783123016357
2026-04-29 07:22:40,"Dear Microsoft stock fans, mark your calendars for May 7",MSFT,Bing RSS,neutral,0.0
2026-04-29 07:42:00,Analysts trim Microsoft-linked crypto stock's target despite AI push,MSFT,Bing RSS,negative,-0.6126556396484375
2026-04-29 15:59:35,Qualcomm to report Q2 earnings as smartphone market faces steep declines,MSFT,Yahoo RSS,positive,0.5359708070755005
2026-04-29 14:17:29,"Nasdaq Composite Treads Carefully Ahead of Big Tech Bonanza, Fed Decision",MSFT,Yahoo RSS,neutral,0.0
2026-04-29 14:08:17,-1.09% for Nvidia stock as broader market selling pressure triggers decline - Traders Union,NVDA,Google RSS,negative,-0.8407544493675232
2026-04-29 09:03:00,Why Is NVIDIA (NVDA) Among The Best Growth Stocks To Buy And Hold In 2026?,NVDA,Bing RSS,neutral,0.0
2026-04-29 16:05:00,"Tariffs, Oil Shocks, and Inflation: The Best Dividend Stocks to Own Through It All",NVDA,Yahoo RSS,neutral,0.0
2026-04-29 15:28:00,A Major Oil Executive Warns That the Global Oil Supply Disruption Could Last Into 2027. Here's What That Means for Oil Stocks.,NVDA,Yahoo RSS,negative,-0.8907026052474976
2026-04-29 15:20:00,The Great Rotation Out of Tech May Already Be Reversing. These Are the Best Artificial Intelligence (AI) Growth Stocks to Buy Now.,NVDA,Yahoo RSS,neutral,0.0
2026-04-29 14:16:19,Wall Street analysts update Meta stock price target ahead of Q1 earnings - Finbold,META,Google RSS,neutral,0.0
2026-04-29 15:59:35,Qualcomm to report Q2 earnings as smartphone market faces steep declines,META,Yahoo RSS,positive,0.5359708070755005
2026-04-29 14:54:05,VIX Climbs as Fed Decision and Mega-Cap Earnings Keep Investors on Edge,META,Yahoo RSS,positive,0.695554256439209
2026-04-29 14:17:29,"Nasdaq Composite Treads Carefully Ahead of Big Tech Bonanza, Fed Decision",META,Yahoo RSS,neutral,0.0
