date,headline,ticker,source,sentiment_label,compound
2026-07-06 20:20:00,Broadcom Stock Rises On New Apple Supply Deal - Investor's Business Daily,AAPL,Google RSS,positive,0.5850635170936584
2026-07-06 21:43:44,"S&P 500, Nasdaq close sharply higher as Broadcom rallies - Reuters",AAPL,Google RSS,positive,0.570421576499939
2026-07-06 12:41:21,"Apple’s stock jump adds $209B, but foldable iPhone numbers lag price rise - TechStock²",AAPL,Google RSS,neutral,0.0
2026-07-06 18:17:00,"Meta Stock Surged 9% to $612.91 on July 1 After Reports That Mark Zuckerberg Is Building a Cloud Business to Compete With Amazon, Microsoft, and Alphabet - The Motley Fool",GOOGL,Google RSS,positive,0.9462510347366332
2026-07-06 17:37:00,"Meta Stock Surged 9% to $612.91 on July 1 After Reports That Mark Zuckerberg Is Building a Cloud Business to Compete With Amazon, Microsoft, and Alphabet - The Globe and Mail",GOOGL,Google RSS,positive,0.945020854473114
2026-07-06 11:28:11,AI Stocks Retail Investors Are Watching in Broadcom ServiceNow and Alphabet - simplywall.st,GOOGL,Google RSS,neutral,0.0
2026-07-04 12:20:28,Alphabet Inc-CL C (NASDAQ:GOOG) Emerges as a Strong Growth Stock with a Favorable Technical Setup - ChartMill,GOOGL,Google RSS,positive,0.9545316100120544
2026-07-06 11:42:00,These 3 Growth Stocks Can Outperform Through AI Tailwinds and Everyday Consumer Strength - The Motley Fool,GOOGL,Google RSS,positive,0.4987840354442596
2026-07-04 11:44:00,Alphabet Officially Joins the Dow. These 3 Dow Dividend Stocks Are Better Buys for July. - The Motley Fool,GOOGL,Google RSS,neutral,0.0
2026-07-03 17:30:00,Alphabet Stock at $356: Is Google Still a Strong Buy in July 2026?,GOOGL,Bing RSS,neutral,0.0
2026-07-06 17:37:00,"Meta Stock Surged 9% to $612.91 on July 1 After Reports That Mark Zuckerberg Is Building a Cloud Business to Compete With Amazon, Microsoft, and Alphabet",GOOGL,Yahoo RSS,positive,0.9450973868370056
2026-07-06 21:01:15,"Amid Strong, Positive Catalysts and the Endorsement of Goldman Sachs, Amazon Stock Looks Very Attractive - Barchart.com",AMZN,Google RSS,positive,0.8514057397842407
2026-07-06 18:17:00,"Meta Stock Surged 9% to $612.91 on July 1 After Reports That Mark Zuckerberg Is Building a Cloud Business to Compete With Amazon, Microsoft, and Alphabet - The Motley Fool",AMZN,Google RSS,positive,0.9462510347366332
2026-07-06 17:37:00,"Meta Stock Surged 9% to $612.91 on July 1 After Reports That Mark Zuckerberg Is Building a Cloud Business to Compete With Amazon, Microsoft, and Alphabet - The Globe and Mail",AMZN,Google RSS,positive,0.945020854473114
2026-07-06 18:46:59,Shopify Stock And The Peril Of A Personal Best,AMZN,Yahoo RSS,negative,-0.6294011473655701
2026-07-06 17:37:00,"Meta Stock Surged 9% to $612.91 on July 1 After Reports That Mark Zuckerberg Is Building a Cloud Business to Compete With Amazon, Microsoft, and Alphabet",AMZN,Yahoo RSS,positive,0.9450973868370056
2026-07-06 17:41:00,Microsoft Stock Selloff Is Creating Value Opportunities In Overlooked Industrial Names - simplywall.st,MSFT,Google RSS,neutral,0.0
2026-07-02 23:55:13,"Why Is Microsoft Stock Falling, and is it a Generational Buying Opportunity? - The Motley Fool",MSFT,Google RSS,negative,-0.7872371077537537
2026-07-02 07:00:00,"Why Is Microsoft Stock Falling, and is it a Generational Buying Opportunity? - AOL.com",MSFT,Google RSS,negative,-0.7495375275611877
2026-07-02 11:52:40,Microsoft stock hits one-year low amid AI spending concerns - qz.com,MSFT,Google RSS,negative,-0.9260715246200562
2026-07-06 21:24:38,"S&P 500, Nasdaq End Higher On Support From Strong Tech Gains Led By Nvidia, Dow Hits Record Highs — MSFT, NVDA, LMT, AVGO, SPCX In Focus",MSFT,Yahoo RSS,positive,0.9290769696235656
2026-07-06 23:24:00,"Dow Jones Futures: AI Stocks Astera, Bloom, Tesla Rebound; SpaceX Slides Ahead Of Nasdaq-100 Inclusion - Investor's Business Daily",NVDA,Google RSS,negative,-0.8786645531654358
2026-07-06 10:03:39,NVIDIA Stock Forecast 2026: Is NVDA Still a Good Investment After the $4 Trillion AI Rally? - WEEX,NVDA,Google RSS,positive,0.6320408582687378
2026-07-06 15:50:00,"The Second-Biggest Stock Sale in History Hits the Nasdaq Friday, and Chip Stocks Are Ripping",NVDA,Bing RSS,neutral,0.0
2026-07-06 23:09:55,"Dow Jones Futures: AI Stocks Astera, Bloom, Tesla Rebound; SpaceX Slides Ahead Of Nasdaq-100 Inclusion",NVDA,Yahoo RSS,negative,-0.8914390206336975
2026-07-06 21:24:38,"S&P 500, Nasdaq End Higher On Support From Strong Tech Gains Led By Nvidia, Dow Hits Record Highs — MSFT, NVDA, LMT, AVGO, SPCX In Focus",NVDA,Yahoo RSS,positive,0.9290769696235656
2026-07-03 08:22:41,Tesla: Shares Fall Despite Strong Second-Quarter Deliveries Growth - Morningstar,TSLA,Google RSS,negative,-0.9698497653007508
2026-07-02 13:07:44,"Tesla stock sinks 7% despite strong deliveries report, posting worst day in nearly a year - CNBC",TSLA,Google RSS,negative,-0.9578706622123718
2026-07-06 23:24:00,"Dow Jones Futures: AI Stocks Astera, Bloom, Tesla Rebound; SpaceX Slides Ahead Of Nasdaq-100 Inclusion - Investor's Business Daily",TSLA,Google RSS,negative,-0.8786645531654358
2026-07-02 21:05:00,Why Tesla’s stock sank to its worst day in a year despite blowout delivery numbers - MarketWatch,TSLA,Google RSS,negative,-0.9040796756744384
2026-07-02 14:19:34,US Open: Nasdaq surges amid semiconductor rebound 🔼 Tesla shares down despite strong deliveries report - XTB.com,TSLA,Google RSS,negative,-0.9647502899169922
2026-07-02 17:06:23,Strong quarterly sales failed to boost Tesla's stock price as analysts await further progress on AI. - 富途牛牛,TSLA,Google RSS,positive,0.4983507096767425
2026-07-06 14:34:03,Tesla stock up 3% today after Thursday's selloff: what's behind the rebound? - Invezz,TSLA,Google RSS,positive,0.9131059050559998
2026-07-06 23:09:55,"Dow Jones Futures: AI Stocks Astera, Bloom, Tesla Rebound; SpaceX Slides Ahead Of Nasdaq-100 Inclusion",TSLA,Yahoo RSS,negative,-0.8914390206336975
2026-07-06 21:18:09,"Update: US Equity Indexes Advance as Communication Services, Technology Top Sector Charts While Crude Oil Trades Steady",TSLA,Yahoo RSS,positive,0.8828745484352112
2026-07-06 17:40:13,"Meta Stock Surged 9% to $612.91 on July 1 After Reports That Mark Zuckerberg Is Building a Cloud Business to Compete With Amazon, Microsoft, and Alphabet - The Globe and Mail",META,Google RSS,positive,0.945020854473114
2026-07-06 14:37:00,"Retail Traders Watch META, MU, BABA, TSLA, And RKLB As AI, Regulation, And Space M&A Drive Markets - foreignpolicyjournal.com",META,Google RSS,neutral,0.0
2026-07-01 15:03:43,Meta stock jumps on report of AI cloud business expansion plans - TradingView,META,Google RSS,neutral,0.0
2026-07-06 11:25:00,"Meta Stock Surged 9% to $612.91 on July 1 After Reports That Mark Zuckerberg Is Building a Cloud Business to Compete With Amazon, Microsoft, and Alphabet",META,Bing RSS,positive,0.9450973868370056
2026-07-06 16:20:19,Morgan Stanley sees smarter AI cloud path for Meta,META,Yahoo RSS,positive,0.6040136814117432
2026-07-04 20:04:00,Netflix (NASDAQ:NFLX) stock’s holiday bounce gives investors clear July watch - TechStock²,NFLX,Google RSS,positive,0.5236369967460632
2026-07-06 08:22:00,AAPL Stock Dips Premarket: Analyst Warns Foldable iPhone Supply Issues Could Blow September Launch Window - Stocktwits,AAPL,Google RSS,negative,-0.9555870890617372
2026-07-06 14:37:00,"Retail Traders Watch META, MU, BABA, TSLA, And RKLB As AI, Regulation, And Space M&A Drive Markets - foreignpolicyjournal.com",AAPL,Google RSS,neutral,0.0
2026-07-06 21:01:15,"Amid Strong, Positive Catalysts and the Endorsement of Goldman Sachs, Amazon Stock Looks Very Attractive",AMZN,Yahoo RSS,positive,0.9232522249221802
2026-07-06 16:39:59,Why Is Microsoft Stock Falling Monday? - Microsoft (NASDAQ:MSFT) - Benzinga,MSFT,Google RSS,negative,-0.9028966426849364
2026-07-07 00:35:01,This Tech Giant Was the Worst-Performing Mega-Cap in the Dow Jones Industrial Average in the First Half. Stock to Avoid or No-Brainer Buying Opportunity? - The Globe and Mail,MSFT,Google RSS,negative,-0.8847668170928955
2026-07-01 16:35:00,Microsoft stock suffers worst month since 2000,MSFT,Bing RSS,negative,-0.9665484428405762
2026-07-02 11:18:00,"Tesla stock sinks 7% despite strong deliveries report, posting worst day in nearly a year",TSLA,Bing RSS,negative,-0.9707358479499816
2026-07-02 19:00:00,Why Tesla’s stock sank to its worst day in a year despite blowout delivery numbers,TSLA,Bing RSS,negative,-0.9143766760826112
2026-07-02 20:25:00,Tesla's Latest Deliveries Report Exceeded Expectations. TSLA Stock Is Falling Anyway.,TSLA,Bing RSS,negative,-0.9692736864089966
2026-07-06 18:17:00,"Meta Stock Surged 9% to $612.91 on July 1 After Reports That Mark Zuckerberg Is Building a Cloud Business to Compete With Amazon, Microsoft, and Alphabet - The Motley Fool",META,Google RSS,positive,0.9462510347366332
2026-07-07 08:00:00,Recent Rumblings From the Fed Could Make This Vanguard Bond ETF a Better Buy,NVDA,Yahoo RSS,positive,0.861805260181427
2026-07-06 13:55:07,Tesla shares nudge higher as Q2 inventory dip weighs on delivery hopes - TechStock²,TSLA,Google RSS,negative,-0.6994713544845581
2026-07-07 10:18:13,"US futures edge lower as investors assess Samsung results and Fed outlook: Dow Jones, S&P, Nasdaq, Wall Street",AAPL,Yahoo RSS,negative,-0.8950697183609009
2026-07-06 21:01:15,"Amid Strong, Positive Catalysts and the Endorsement of Goldman Sachs, Amazon Stock Looks Very Attractive - Barchart",AMZN,Google RSS,positive,0.923684298992157
2026-07-07 10:50:00,Tesla (NASDAQ: TSLA) Posts Strong Q2 Deliveries But Stock Selloff Signals Deeper Investor Concerns - foreignpolicyjournal.com,TSLA,Google RSS,negative,-0.8224143981933594
2026-07-07 07:55:22,NBIS Stock Down About 30% From Peak Amid Meta AI Cloud Threat — But Retail Still Believes In Neocloud Opportunity - Stocktwits,META,Google RSS,negative,-0.9709031581878662
2026-07-07 07:54:24,NBIS Stock Down About 30% From Peak Amid Meta AI Cloud Threat — But Retail Still Believes In Neocloud Opportunity,META,Yahoo RSS,negative,-0.9684922099113464
2026-07-07 12:46:00,Update: Market Chatter: Amazon Looking to Raise at Least $25 Billion From US Bond Sale,AMZN,Yahoo RSS,positive,0.8689067363739014
2026-07-07 12:44:50,"Marvell Technology Poised to Sustain 40%+ Growth for Next 3 Years on Strong AI Demand, RBC Says",AMZN,Yahoo RSS,positive,0.9514613151550292
2026-07-07 12:44:50,"Marvell Technology Poised to Sustain 40%+ Growth for Next 3 Years on Strong AI Demand, RBC Says",MSFT,Yahoo RSS,positive,0.9514613151550292
2026-07-07 13:09:59,"IREN stock jumps on analyst upgrade, sees nearly 50% upside",META,Yahoo RSS,positive,0.9355378746986388
2026-07-07 15:50:13,July Is the S&P 500's Best Month: These 5 Tech Stocks Beat the Market,AAPL,Yahoo RSS,positive,0.7490282654762268
2026-07-07 15:42:00,Amazon Readies $25 Billion Bond With AI Costs Rising - Investor's Business Daily,AMZN,Google RSS,neutral,0.0
2026-07-07 16:20:00,"Microsoft and Palantir Stocks Both Hit 52-Week Lows, but Only 1 Is a Buy Right Now (the Answer May Surprise You)",MSFT,Yahoo RSS,negative,-0.6044442653656006
2026-07-07 17:15:00,"Apple App Store growth slows in June quarter, UBS analysis shows",AAPL,Yahoo RSS,negative,-0.96505206823349
2026-07-07 17:36:40,Google's Pixel 11 Set for August Release with Higher Prices (GOO - GuruFocus,GOOGL,Google RSS,positive,0.5158445239067078
2026-07-07 17:02:41,Traders Are Dumping Tech Bonds to Make Room for Amazon Debt Deal,GOOGL,Yahoo RSS,negative,-0.942617654800415
2026-07-07 17:25:57,Update: US Equity Indexes Retreat as Chipmakers Hit Technology While Crude Oil Jumps Following Hormuz Missile Strike,AMZN,Yahoo RSS,negative,-0.9555636048316956
2026-07-07 17:02:41,Traders Are Dumping Tech Bonds to Make Room for Amazon Debt Deal,AMZN,Yahoo RSS,negative,-0.942617654800415
2026-07-07 17:00:00,"Microsoft and Palantir Stocks Both Hit 52-Week Lows, but Only 1 Is a Buy Right Now (the Answer May Surprise You) - The Motley Fool",MSFT,Google RSS,negative,-0.6946479678153992
2026-07-07 01:05:00,This Tech Giant Was the Worst-Performing Mega-Cap in the Dow Jones Industrial Average in the First Half. Stock to Avoid or No-Brainer Buying Opportunity? - The Motley Fool,MSFT,Google RSS,negative,-0.8266436457633972
2026-07-07 18:03:00,Jim Cramer sends strong signal to Nvidia stock investors amid rumors - thestreet.com,NVDA,Google RSS,positive,0.7141926288604736
2026-07-07 18:40:00,"Tesla sales jump 25%, topping forecasts as Musk boycott backlash appears to fade - The Cool Down",TSLA,Google RSS,positive,0.9376816749572754
2026-07-06 07:51:00,Tesla stock up 3% today after Thursday's selloff: what's behind the rebound?,TSLA,Bing RSS,positive,0.7014004588127136
2026-07-06 15:06:12,Meta stock edges higher as AI delays meet cloud ambitions - MSN,META,Google RSS,positive,0.7960854768753052
2026-07-02 10:43:00,Meta stock falls as AI cloud plans hit an immediate snag,META,Bing RSS,negative,-0.8652611374855042
2026-07-07 17:02:41,Traders Are Dumping Tech Bonds to Make Room for Amazon Debt Deal,META,Yahoo RSS,negative,-0.942617654800415
2026-07-07 19:46:07,Sector Update: Consumer Stocks Mixed Late Afternoon,NFLX,Yahoo RSS,negative,-0.9352520108222961
