date,headline,ticker,source,sentiment_label,compound
2026-06-03 17:45:36,"Apple Investors Looking For A WWDC Boost May Be Disappointed, UBS Warns - Stocktwits",AAPL,Google RSS,negative,-0.9243457913398744
2026-06-03 03:42:56,S&P 500 Stocks Trading At 52-Week High - Trefis,AAPL,Google RSS,positive,0.538077712059021
2026-06-03 08:42:08,Liberty Atlantic Advisors LLC Acquires New Stake in Apple Inc. $AAPL - MarketBeat,AAPL,Google RSS,neutral,0.0
2026-06-03 16:07:26,"Apple Investors Looking For A WWDC Boost May Be Disappointed, UBS Warns",AAPL,Yahoo RSS,negative,-0.7368497848510742
2026-06-03 14:06:25,UBS maintains Alphabet stock rating on cloud margin concerns - Investing.com,GOOGL,Google RSS,neutral,0.0
2026-06-03 04:21:08,Bad news for Alphabet stock is good news for copper investors - MSN,GOOGL,Google RSS,neutral,0.0
2026-06-03 23:43:31,"Dow Logs Worst Day Since March, S&P 500 And Nasdaq Snap Win Streak After US-Iran Exchange Fire — SNDK, TSLA, GOOGL, META, IREN In Focus",GOOGL,Yahoo RSS,negative,-0.9062460660934448
2026-06-01 09:30:17,Citizens reiterates Amazon stock rating on cloud growth outlook - Investing.com,AMZN,Google RSS,neutral,0.0
2026-06-03 18:40:00,Consumer Stocks Have Fallen Behind. These Retail Names Still Stand Out.,AMZN,Yahoo RSS,neutral,0.0
2026-06-01 17:04:00,Microsoft’s stock chart just flashed a bullish signal for a software comeback - MarketWatch,MSFT,Google RSS,positive,0.7376468777656555
2026-06-02 14:30:00,"This ""Magnificent Seven"" Stock May Still Be the Best Bargain in Tech Right Now - The Motley Fool",MSFT,Google RSS,neutral,0.0
2026-06-02 06:45:02,"Microsoft stock is up nearly 30% from its March lows, but you shouldn’t sell MSFT just yet",MSFT,Bing RSS,positive,0.9460569024086
2026-06-02 13:35:30,Microsoft stock just hit a 3-month high. Investors can thank a 'new era of PC.',MSFT,Bing RSS,neutral,0.0
2026-05-29 16:55:00,"Stock Market Today, May 29: Microsoft Rises as $37 Billion AI Run Rate Highlights Cloud Growth",MSFT,Bing RSS,negative,-0.6411459445953369
2026-06-04 03:06:21,"Stocks drop on AI, rate hike worries as Lebanon deal hits oil",NVDA,Yahoo RSS,negative,-0.9269195199012756
2026-06-04 02:49:45,MRVL Stock Slides Overnight After Record Close: Retail Traders Keep The Faith,NVDA,Yahoo RSS,negative,-0.9560085535049438
2026-06-04 01:00:00,"Cooler Master and Spingence Launch Global AI Manufacturing Initiative: Implementing NVIDIA Three-Computer Architecture to Create a Multinational ""Digital Brain""",NVDA,Yahoo RSS,neutral,0.0
2026-06-01 10:07:17,Tesla Resolves Graphite Supply Default With Syrah Resources - Gotrade,TSLA,Google RSS,neutral,0.0
2026-06-03 23:43:31,"Dow Logs Worst Day Since March, S&P 500 And Nasdaq Snap Win Streak After US-Iran Exchange Fire — SNDK, TSLA, GOOGL, META, IREN In Focus",TSLA,Yahoo RSS,negative,-0.9062460660934448
2026-06-03 21:36:51,"Stock Market Today, June 3: Rivian Automotive Jumps on Strong R2 SUV Order Interest",TSLA,Yahoo RSS,positive,0.9450754523277284
2026-06-04 00:03:27,"META Stock Still Trails Mag 7 Peers Even After New Subscriptions, Layoffs, Cloud Plans — Retail Sniffs Buying Opportunity - Stocktwits",META,Google RSS,neutral,0.0
2026-06-02 02:47:55,"META Stock Still Trails Mag 7 Peers Even After New Subscriptions, Layoffs, Cloud Plans — Retail Sniffs Buying Opportunity - TradingView",META,Google RSS,positive,0.7001081705093384
2026-06-04 01:27:33,"ACV Auctions, CarGurus, and LendingTree Shares Are Falling, What You Need To Know",META,Yahoo RSS,neutral,0.0
2026-06-02 15:48:26,How Much Upside Can AMZN Stock's Growth Deliver?,NFLX,Yahoo RSS,neutral,0.0
2026-05-30 16:41:45,"Netflix, Inc. (NFLX) Expands Consumer Products With New Partnerships and Strong Growth Outlook",NFLX,Yahoo RSS,positive,0.9366454482078552
2026-06-02 17:50:29,Apple Stock (AAPL) Hits All-Time High Ahead of Highly-Anticipated Developer Conference - TipRanks,AAPL,Google RSS,positive,0.7265971302986145
2026-06-03 07:42:36,"Alphabet's $80 billion stock sale leaves Wall Street in 'unprecedented territory,' says Goldman's Gutman - CNBC",GOOGL,Google RSS,negative,-0.9351064562797546
2026-06-04 06:50:38,TSMC Warns Chip Supply Won’t Meet AI-Fueled Demand for Years,NVDA,Yahoo RSS,negative,-0.7473212480545044
2026-06-03 22:03:15,Netflix stock is on track for its longest losing streak since 2022 - MSN,NFLX,Google RSS,negative,-0.9109138250350952
2026-05-30 00:28:00,"Stock Market Today, May 29: Microsoft Rises as $37 Billion AI Run Rate Highlights Cloud Growth - The Motley Fool",MSFT,Google RSS,positive,0.6601969003677368
2026-06-04 10:29:30,Q1 Earnings Highlights: Microsoft (NASDAQ:MSFT) Vs The Rest Of The Automation Software Stocks,MSFT,Yahoo RSS,neutral,0.0
2026-06-04 11:20:00,Will AI Productivity Gains Allow Fed Chair Kevin Warsh to Cut Interest Rates?,NVDA,Yahoo RSS,negative,-0.3962866961956024
2026-06-04 10:35:00,3 Things to Know About Home Depot Stock Before You Buy,NVDA,Yahoo RSS,neutral,0.0
2026-06-03 18:44:29,Netflix stock heads for worst losing streak in nearly four years - TradingView,NFLX,Google RSS,negative,-0.9441120028495787
2026-06-04 08:39:54,"Wall Street's AI gold rush hits ""unprecedented territory"" with Alphabet's $80 billion stock sale",GOOGL,Bing RSS,positive,0.5731843113899231
2026-06-02 20:35:30,Microsoft Stock Just Hit a 3-Month High. Investors Can Thank a ‘New Era of PC.’ - Barchart.com,MSFT,Google RSS,neutral,0.0
2026-06-04 07:08:00,Microsoft (MSFT) Stock Climbs Following Build 2026 Conference Announcements,MSFT,Bing RSS,positive,0.7461521029472351
2026-06-04 15:33:14,Microsoft xPilot Links AI Retail Twins To Long Term Azure Story,MSFT,Yahoo RSS,neutral,0.0
2026-06-04 13:15:00,Virtuix to Highlight AI-Driven Growth Across Consumer XR and Defense Simulation Markets at June Investor Conferences,META,Yahoo RSS,neutral,0.0
2026-06-04 11:50:00,Stock Market Today: Indexes Rise Despite Broadcom-Led Tech Pullback; Dow Soars 850 Points to All-Time High; Oil Retreats,AAPL,Bing RSS,positive,0.7393576502799988
2026-06-04 17:25:00,Amazon Lands $4 Billion AI Cloud Deal From Pinterest. Both Stocks Are Higher. - Investor's Business Daily,AMZN,Google RSS,positive,0.8417093753814697
2026-06-04 11:45:01,"Microsoft stock is up nearly 30% from its March lows, but you shouldn’t sell MSFT just yet - MSN",MSFT,Google RSS,positive,0.9318295121192932
2026-06-04 18:35:00,"As Global Markets Reach Historic Heights, a Distinguished Opportunity Emerges in Elektros INC. Lithium Mining, Rare Earth Minerals, and EV Patent Technology for a New Era of Growth",TSLA,Yahoo RSS,positive,0.7720864415168762
2026-06-01 20:59:00,"META Stock Still Trails Mag 7 Peers Even After New Subscriptions, Layoffs, Cloud Plans — Retail Sniffs Buying Opportunity",META,Bing RSS,positive,0.7291463017463684
2026-06-04 21:11:50,"Stock Market Today, June 4: Dow Hits Record as Tech Stocks Falter - The Motley Fool",GOOGL,Google RSS,negative,-0.8187527060508728
2026-06-04 21:28:36,"Stock Market Today, June 4: Dow Hits Record as Tech Stocks Falter",GOOGL,Yahoo RSS,negative,-0.5713541507720947
2026-06-04 21:27:43,"Dow Jones Hits High, AI Stocks Shrug Off Broadcom, Ciena Sell-Offs; Jobs Report Looms",GOOGL,Yahoo RSS,negative,-0.8350685238838196
2026-06-04 21:17:44,"Nvidia stock performance a sign of changing AI market, says investor - MSN",NVDA,Google RSS,positive,0.5662773847579956
2026-06-04 21:23:39,"Stock Market Today, June 4: Broadcom Shares Plunge After AI Outlook Misses High Investor Expectations",NVDA,Yahoo RSS,negative,-0.9704571962356568
2026-06-04 21:01:48,"Nvidia stock performance a sign of changing AI market, says investor",NVDA,Yahoo RSS,positive,0.7151457071304321
2026-06-03 11:44:29,Netflix stock heads for worst losing streak in nearly four years,NFLX,Bing RSS,negative,-0.9357958436012268
2026-06-03 13:46:15,Microsoft (MSFT) Slid Despite Top and Bottom-Line Beats,MSFT,Yahoo Global,negative,-0.966448187828064
2026-06-04 13:36:49,"‘Integration Runs Deep,’ Says Top Investor About Alphabet Stock - TipRanks",GOOGL,Google RSS,neutral,0.0
