date,headline,ticker,source,sentiment_label,compound
2026-05-19 22:56:00,"Apple Hanging Near All-Time High, Among 15 New To Best Growth Stock Lists - Investor's Business Daily",AAPL,Google RSS,positive,0.7014902830123901
2026-05-19 11:22:23,"Stocks making the biggest moves premarket: Home Depot, Amer Sports, Blackstone, Alphabet & more - CNBC",GOOGL,Google RSS,neutral,0.0
2026-05-19 11:35:00,CoreWeave’s stock falls as new Google cloud venture may signal more competition ahead - MarketWatch,GOOGL,Google RSS,negative,-0.961402416229248
2026-05-19 18:21:00,2 AI Stocks That Will Still Be Dominant When Today's Hype Has Faded - The Motley Fool,GOOGL,Google RSS,neutral,0.0
2026-05-19 17:49:00,2 AI Stocks That Will Still Be Dominant When Today's Hype Has Faded - The Globe and Mail,GOOGL,Google RSS,neutral,0.0
2026-05-18 14:47:06,Alphabet stock price forecast: $399.00–$412.00 range as GOOGL gains 1.57% - Traders Union,GOOGL,Google RSS,positive,0.5035989880561829
2026-05-19 21:00:37,US Equity Indexes Fall as Trump's Warnings to Resolve Iran Standoff Send Treasury Yields Sharply Higher,GOOGL,Yahoo RSS,negative,-0.9561110734939576
2026-05-19 20:50:35,"Stock Market Today: Dow, Nasdaq End In The Red As Yields Jump; Alphabet Drops On I/O Day (Live Coverage)",GOOGL,Yahoo RSS,negative,-0.9011259078979492
2026-05-19 12:36:00,Amazon Stock (AMZN) Falls despite Cloud Industrial Intelligence Push - TipRanks,AMZN,Google RSS,negative,-0.9677991271018982
2026-05-19 18:21:00,2 AI Stocks That Will Still Be Dominant When Today's Hype Has Faded - The Motley Fool,AMZN,Google RSS,neutral,0.0
2026-05-20 02:37:46,"Cisco, Amazon.com Inc. share losses lead Dow's 175-point fall - MSN",AMZN,Google RSS,negative,-0.96002858877182
2026-05-19 15:54:53,"US stock market crashes today: Dow Jones, S&P 500, and Nasdaq fall hard as bond yields hit 19-year high - - The Economic Times",AMZN,Google RSS,negative,-0.9520699977874756
2026-05-19 21:00:37,US Equity Indexes Fall as Trump's Warnings to Resolve Iran Standoff Send Treasury Yields Sharply Higher,AMZN,Yahoo RSS,negative,-0.9561110734939576
2026-05-19 17:38:00,AIHA Announces Star Sponsors for AIHA Connect 2026 Conference,AMZN,Yahoo RSS,neutral,0.0
2026-05-19 17:35:00,Home Depot Q1: The Big Shift Everyone is Missing,AMZN,Yahoo RSS,neutral,0.0
2026-05-19 21:49:58,Microsoft Shares Slip Again While AI Bulls Confront Rate Jitters - TechStock²,MSFT,Google RSS,negative,-0.9187278151512146
2026-05-17 11:43:17,Top Wall Street analysts suggest these 3 stocks for their long-term prospects - CNBC,MSFT,Google RSS,neutral,0.0
2026-05-19 09:07:47,Microsoft Corporation $MSFT Shares Sold by Loring Wolcott & Coolidge Fiduciary Advisors LLP MA - MarketBeat,MSFT,Google RSS,neutral,0.0
2026-05-18 15:30:00,2 Top Nasdaq Stocks to Buy Before They Soar in 2026 - The Motley Fool,MSFT,Google RSS,neutral,0.0
2026-05-18 13:35:39,"‘Still One of the Best,’ Says Investor About Microsoft Stock - TipRanks",MSFT,Google RSS,neutral,0.0
2026-05-19 16:28:00,3G Capital Exits Microsoft Stock in Major Portfolio Shift. MSFT Is Still One of the Best AI Plays Now.,MSFT,Bing RSS,neutral,0.0
2026-05-19 20:58:00,"These Stocks Are Today’s Movers: CoreWeave, Nvidia, Home Depot, Akamai, Agilysys, Micron, and More - Barron's",NVDA,Google RSS,neutral,0.0
2026-05-19 11:48:00,Veteran analyst firm revises Nvidia stock price target ahead of earnings - TradingView,NVDA,Google RSS,neutral,0.0
2026-05-19 17:52:06,Morgan Stanley resets Nvidia stock price target ahead of earnings - thestreet.com,NVDA,Google RSS,neutral,0.0
2026-05-19 09:23:00,"Nvidia Stock May or May Not Soar on May 20, But This Super AI Semiconductor Stock Could Pop and Go On a Terrific Bull Run - The Motley Fool",NVDA,Google RSS,neutral,0.0
2026-05-19 16:44:10,Nvidia remains most shorted stock ahead of earnings - TradingView,NVDA,Google RSS,negative,-0.861302375793457
2026-05-19 11:31:21,Veteran analyst firm revises Nvidia stock price target ahead of earnings - GuruFocus,NVDA,Google RSS,neutral,0.0
2026-05-17 12:48:55,"1 Stock to Buy, 1 Stock to Sell This Week: Nvidia, Home Depot - Investing.com",NVDA,Google RSS,neutral,0.0
2026-05-19 17:02:04,Nvidia stock erases early losses ahead of earnings: what to expect - TradingView,NVDA,Google RSS,neutral,0.0
2026-05-19 17:31:21,Nvidia stock erases early losses ahead of earnings: what to expect - CryptoRank,NVDA,Google RSS,negative,-0.7783932089805603
2026-05-19 21:17:00,Nvidia stock set for 3-day losing streak. Why that could be a positive. - MSN,NVDA,Google RSS,negative,-0.8948439359664917
2026-05-19 09:49:00,Morgan Stanley raises Nvidia stock price target ahead of earnings,NVDA,Bing RSS,neutral,0.0
2026-05-19 23:55:00,Review & Preview: Bonds Bury Stocks,NVDA,Yahoo RSS,neutral,0.0
2026-05-19 23:00:00,"What investors need to watch on May 20: Nvidia, Fed Minutes",NVDA,Yahoo RSS,neutral,0.0
2026-05-19 22:59:13,Wall St ends lower as inflation worries push up yields,NVDA,Yahoo RSS,negative,-0.8814998269081116
2026-05-19 22:27:57,"Stock market today: Dow, S&P 500, Nasdaq futures dip in countdown to Nvidia earnings",NVDA,Yahoo RSS,negative,-0.9450761079788208
2026-05-19 21:31:09,"Stock Market Today, May 19: Soaring Treasury Yields Pressure Markets",NVDA,Yahoo RSS,negative,-0.8988906145095825
2026-05-18 15:10:09,Model Y price reduction drags Tesla stock down 2.78% on Tuesday - Traders Union,TSLA,Google RSS,negative,-0.9709229469299316
2026-05-19 15:18:10,Meta's AI Worker Shift; Home Depot Sales Fall Short | Stock Movers - marketscreener.com,META,Google RSS,negative,-0.7715554237365723
2026-05-19 00:00:00,Watch Meta's AI Worker Shift; Home Depot Sales Fall Short | Stock Movers - Bloomberg.com,META,Google RSS,negative,-0.6340992450714111
2026-05-19 14:48:39,Netflix Stock Forecast: Analysts See Strong Upside Potential - TipRanks,NFLX,Google RSS,positive,0.8818963766098022
2026-05-17 11:03:13,"Soltis Investment Advisors LLC Has $4.06 Million Stock Position in Netflix, Inc. $NFLX - MarketBeat",NFLX,Google RSS,neutral,0.0
2026-05-19 12:05:28,"Stocks making the biggest moves premarket: Home Depot, Amer Sports, Blackstone, Alphabet & more",GOOGL,CNBC Finance,neutral,0.0
2026-05-15 18:45:11,"Stocks making the biggest moves midday: Cerebras, Microsoft, ServiceNow, Papa John's & more",MSFT,CNBC Finance,neutral,0.0
2026-05-18 16:21:52,Alphabet or Micron: Top Investor Chooses the Elite AI Stock to Buy - TipRanks,GOOGL,Google RSS,neutral,0.0
2026-05-20 06:38:14,"Alphabet Inc. (NASDAQ:GOOGL) Receives Average Rating of ""Moderate Buy"" from Analysts - MarketBeat",GOOGL,Google RSS,positive,0.7956985831260681
2026-05-19 00:44:41,Alphabet (GOOGL) Valuation Check After Strong Recent Share Price Momentum - simplywall.st,GOOGL,Google RSS,neutral,0.0
2026-05-15 15:51:20,"Stocks making the biggest moves midday: Cerebras, Microsoft, ServiceNow, Papa John's & more - CNBC",MSFT,Google RSS,neutral,0.0
2026-05-20 07:16:55,"European stocks tick lower as Nvidia earnings release, inflation fears loom large - Investing.com",NVDA,Google RSS,negative,-0.9535425901412964
2026-05-20 07:56:00,"Stock Market Today: S&P 500 and Nasdaq look to snap 3-day losing streak, Dow also called higher, as traders await Nvidia earnings; Treasury yields and oil prices dip. - MarketWatch",NVDA,Google RSS,negative,-0.8757264018058777
2026-05-20 02:07:00,"Asian stocks extend losing streak as higher yields bite, Nvidia results in focus - Reuters",NVDA,Google RSS,negative,-0.679375410079956
2026-05-20 06:19:05,Nvidia stock erases early losses ahead of earnings: what to expect - Cryptonews.net,NVDA,Google RSS,negative,-0.5093159079551697
2026-05-20 08:27:43,Stock futures edge higher ahead of Nvidia earnings (SPX:) - Seeking Alpha,NVDA,Google RSS,positive,0.900077223777771
2026-05-20 06:34:17,TSLA stock rises overnight: Elon Musk drops 'quiet period' hint amid Tesla-SpaceX merger buzz - MSN,TSLA,Google RSS,negative,-0.5746855735778809
2026-05-20 07:09:28,Meta (META) Stock; Slips as Global Layoffs Overshadow Strong Shift Toward AI Teams - CoinCentral,META,Google RSS,negative,-0.961243450641632
2026-05-20 09:24:28,Alphabet stock (US02079K3059): Search expands after AI and cloud push - AD HOC NEWS,GOOGL,Google RSS,positive,0.5860729217529297
2026-05-17 09:14:43,Microsoft Corporation $MSFT Position Boosted by Kingswood Wealth Advisors LLC - MarketBeat,MSFT,Google RSS,positive,0.903846263885498
2026-05-19 17:02:02,3G Capital Exits Microsoft Stock in Major Portfolio Shift. MSFT Is Still One of the Best AI Plays Now. - Barchart.com,MSFT,Google RSS,neutral,0.0
2026-05-20 06:34:26,Microsoft (MSFT) Stock; Dips as Strong Azure Growth Offset by Higher Rate Jitters - CoinCentral,MSFT,Google RSS,negative,-0.9332839250564576
2026-05-20 11:47:00,S&P 500 futures tick higher as oil falls and traders await Nvidia’s earnings: Live updates - CNBC,NVDA,Google RSS,neutral,0.0
2026-05-20 10:08:41,US stock futures climb as chip stocks rebound ahead of Nvidia results - Reuters,NVDA,Google RSS,negative,-0.4015363454818725
2026-05-20 10:01:05,Tech Bulls Are Looking to Nvidia for Stocks Revival - Bloomberg.com,NVDA,Google RSS,neutral,0.0
2026-05-20 02:07:00,"Bond yields pause near recent peak, stocks steady ahead of Nvidia results - Reuters",NVDA,Google RSS,neutral,0.0
2026-05-20 10:35:19,"Stock Market Today (May 20, 2026): Nasdaq futures rise ahead of Nvidia earnings - thestreet.com",NVDA,Google RSS,positive,0.9204487204551696
2026-05-20 08:57:15,"Dow Jones futures fall with Nvidia earnings due; Micron, SanDisk, Astera rise - MSN",NVDA,Google RSS,negative,-0.9219601154327391
2026-05-20 08:50:39,Stock futures edge higher ahead of Nvidia earnings - MSN,NVDA,Google RSS,positive,0.7669607400894165
2026-05-20 02:12:00,"Stock market today: Dow, S&P 500, Nasdaq futures rise in countdown to Nvidia earnings",NVDA,Bing RSS,positive,0.5503727197647095
2026-05-20 03:08:08,US stock futures climb as chip stocks rebound ahead of Nvidia results,NVDA,Bing RSS,positive,0.4695745408535003
2026-05-20 09:07:16,"TSLA Stock Climbs Premarket, But Gary Black Says Rising Oil, Bond Yields Make NVDA, GOOG, META Cheaper Bets - Stocktwits",TSLA,Google RSS,neutral,0.0
2026-05-20 09:19:03,Tesla Faces High Valuation and Interest Rate Risks - Intellectia AI,TSLA,Google RSS,neutral,0.0
2026-05-20 09:07:16,"TSLA Stock Climbs Premarket, But Gary Black Says Rising Oil, Bond Yields Make NVDA, GOOG, META Cheaper Bets - Stocktwits",META,Google RSS,neutral,0.0
2026-05-20 11:00:00,QuidelOrtho to Participate in Upcoming June 2026 Investor Conferences,META,Yahoo RSS,neutral,0.0
2026-05-20 12:44:24,Apple stock (US0378331005): trading near 52-week high after strong iPhone and services momentum - AD HOC NEWS,AAPL,Google RSS,positive,0.9308997988700867
2026-05-20 14:16:43,-2.40% for Alphabet stock as intraday signals point to forming oversold base - Traders Union,GOOGL,Google RSS,negative,-0.7966734170913696
2026-05-20 14:07:00,Amazon Stock (AMZN) Opinions on Strong AWS Growth Amid Valuation Discussions - Quiver Quantitative,AMZN,Google RSS,positive,0.726513683795929
2026-05-20 13:00:00,"Hedge Funds Followed the April Equity Rally by Increasing Exposure to Technology Leaders, Hazeltree Finds",AMZN,Yahoo RSS,positive,0.9261926412582397
2026-05-20 14:31:05,Microsoft stock holds steady as 23% earnings growth boosts outlook - Traders Union,MSFT,Google RSS,positive,0.9457637071609497
2026-05-20 15:18:14,"Stock Market Today: Major Indexes Soar Ahead of Nvidia Earnings; Dow Adds 450 Points; Bond Yields, Oil Prices Pull Back - Investopedia",NVDA,Google RSS,positive,0.4540916085243225
2026-05-20 14:42:02,Chip stocks regain momentum as software shares fall ahead of Nvidia earnings - MarketWatch,NVDA,Google RSS,negative,-0.9592475295066833
2026-05-20 14:26:45,Wall St rises on chips' strength ahead of Nvidia results - Reuters,NVDA,Google RSS,positive,0.7365866899490356
2026-05-20 14:41:48,Nvidia stock rallies with session highs tested after an upbeat trading day - Traders Union,NVDA,Google RSS,positive,0.8623415231704712
2026-05-20 02:07:00,"Bond yields pause near recent highs, stocks steady ahead of Nvidia results - Reuters",NVDA,Google RSS,neutral,0.0
2026-05-20 12:16:19,S&P 500 futures rise ahead of Nvidia Q1 earnings - qz.com,NVDA,Google RSS,neutral,0.0
2026-05-20 13:00:17,"European stocks steady as Nvidia earnings release, inflation fears loom large - Investing.com",NVDA,Google RSS,negative,-0.6368058919906616
2026-05-20 08:27:00,US Stock Market Today | Dow Jones | Nasdaq Live: Nvidia to announce Q1 earnings tonight; US stocks trade higher,NVDA,Bing RSS,positive,0.5149153470993042
2026-05-20 14:55:12,Home Depot Price Targets Slashed Across Wall Street After Q1: Has the Home Improvement Slowdown Just Begun?,NVDA,Yahoo RSS,negative,-0.935512125492096
2026-05-20 13:00:00,"Hedge Funds Followed the April Equity Rally by Increasing Exposure to Technology Leaders, Hazeltree Finds",TSLA,Yahoo RSS,positive,0.9261926412582397
2026-05-18 14:02:47,Meta stock falls sharply after strong earnings. What’s dragging it down? - MSN,META,Google RSS,negative,-0.9088540077209473
2026-05-20 13:00:00,"Hedge Funds Followed the April Equity Rally by Increasing Exposure to Technology Leaders, Hazeltree Finds",META,Yahoo RSS,positive,0.9261926412582397
2026-05-19 22:27:57,"Stock market today: S&P 500, Nasdaq rise in countdown to Nvidia earnings",NVDA,Yahoo Global,positive,0.5259098410606384
