date,headline,ticker,source,sentiment_label,compound
2026-07-21 16:50:00,Apple Reinvents the upgrade cycle. Stock price moves higher - investingLive,AAPL,Google RSS,neutral,0.0
2026-07-17 13:40:16,Apple stock's 12-day momentum triggers sell signal not seen since 2020 (AAPL:NASDAQ) - Seeking Alpha,AAPL,Google RSS,neutral,0.0
2026-07-17 20:19:25,Top analyst resets Apple stock price target ahead of earnings - thestreet.com,AAPL,Google RSS,neutral,0.0
2026-07-16 06:57:00,AAPL: Apple Stock Closes at New All-Time High as Traders Expect Bumper Earnings - TradingView,AAPL,Google RSS,negative,-0.5702929496765137
2026-07-21 16:50:33,Apple Reinvents the upgrade cycle. Stock price moves higher - TradingView,AAPL,Google RSS,neutral,0.0
2026-07-22 16:53:03,Intel Earnings Might Prove the AI Boom Is Still Going Strong — Or About to Stall,AAPL,Yahoo RSS,positive,0.8662676215171814
2026-07-22 22:15:00,"Stock Market Today: Dow ends fractionally lower, S&P 500 and Nasdaq fall with Alphabet and Tesla earnings on deck. Oil prices rise sharply as Trump threatens to bomb Iranian infrastructure - MarketWatch",GOOGL,Google RSS,negative,-0.9687535166740416
2026-07-22 21:12:33,'Fast Money' traders react to Alphabet earnings as stock dips in extended trading - CNBC,GOOGL,Google RSS,negative,-0.7477507591247559
2026-07-22 21:47:40,Evercore ISI reiterates Alphabet stock rating on strong cloud growth - Investing.com,GOOGL,Google RSS,neutral,0.0
2026-07-21 14:07:53,"Alphabet's Gemini delay, spending worries loom over earnings - Reuters",GOOGL,Google RSS,negative,-0.7895050644874573
2026-07-22 22:08:35,Alphabet CFO Says Demand Still Outpaces Capacity: AI Infrastructure Stocks Rise - Benzinga,GOOGL,Google RSS,negative,-0.5101512670516968
2026-07-21 19:45:16,The Mag 7 Stocks Are in a Rut—Can Strong Earnings Get Them Out of It? - Investopedia,GOOGL,Google RSS,negative,-0.8344143629074097
2026-07-22 23:53:17,Can a cloud backlog exceeding $500 billion fail to rescue the stock price? Alphabet earnings call transcript: Heavy AI investments spark disagreement - Moomoo,GOOGL,Google RSS,negative,-0.8626289963722229
2026-07-22 16:06:49,"Alphabet's AI earnings surge, stock drops",GOOGL,Bing RSS,negative,-0.562118411064148
2026-07-22 23:17:36,"S&P 500, Nasdaq close lower ahead of technology earnings",GOOGL,Yahoo RSS,negative,-0.946113109588623
2026-07-22 22:57:42,Google reports 12th consecutive quarter of strong revenue gains,GOOGL,Yahoo RSS,positive,0.9479026794433594
2026-07-22 21:07:17,"Update: US Equity Indexes Fall as Treasury Yields, Crude Oil Gains Reflect Concern Over Widening Disruption to Energy Supplies",GOOGL,Yahoo RSS,negative,-0.9701131582260132
2026-07-22 21:34:05,How Investors May Respond To Amazon.com (AMZN) AWS’s AI-Driven Strength Ahead Of July 30 Earnings - simplywall.st,AMZN,Google RSS,neutral,0.0
2026-07-21 18:31:26,NVIDIA and Amazon: 2 Growth Stocks to Buy as Inflation Eases - Zacks Investment Research,AMZN,Google RSS,neutral,0.0
2026-07-20 17:30:43,Amazon Stock And 2 E Commerce Shares Facing Europe’s Retail Crackdown - simplywall.st,AMZN,Google RSS,neutral,0.0
2026-07-22 14:55:42,Bernstein reiterates Microsoft stock rating on AI growth outlook - Investing.com,MSFT,Google RSS,neutral,0.0
2026-07-22 18:58:32,"CapEx Is in Focus for Microsoft Stock Ahead of Q4 Earnings, But the Bull Case Remains Strong - Barchart.com",MSFT,Google RSS,neutral,0.0
2026-07-22 14:11:31,Microsoft stock may move 6.7% on July 29 earnings report - Investing.com,MSFT,Google RSS,neutral,0.0
2026-07-22 13:56:33,Truist reiterates Microsoft stock rating on Azure growth outlook - Investing.com,MSFT,Google RSS,neutral,0.0
2026-07-18 03:43:43,Should You Buy Microsoft Stock Before the Huge Investor Update? - The Motley Fool,MSFT,Google RSS,neutral,0.0
2026-07-19 14:22:00,Microsoft Stock Sits at $394 as Analysts Cut Targets. Why Most Still Say Buy - TIKR.com,MSFT,Google RSS,neutral,0.0
2026-07-21 00:49:34,Stronger technical forecast for Microsoft stock price after Monday trading - StockInvest.us,MSFT,Google RSS,positive,0.8347436189651489
2026-07-22 21:03:28,Here’s Why Retail Investors Are Buying Microsoft (MSFT) on the Dip,MSFT,Yahoo RSS,neutral,0.0
2026-07-21 19:03:00,Dow Jones Banking Giant JPMorgan In A Buy Zone; Nvidia Stock Tests Key Level - Investor's Business Daily,NVDA,Google RSS,neutral,0.0
2026-07-22 10:25:00,Prediction: Nvidia Stock Will Jump Higher After August Earnings - The Motley Fool,NVDA,Google RSS,positive,0.93962961435318
2026-07-22 19:53:33,Nvidia stock surges 4% amid bullish analyst rat... - Pluang,NVDA,Google RSS,positive,0.8172393441200256
2026-07-22 03:25:00,Prediction: Nvidia Stock Will Jump Higher After August Earnings,NVDA,Bing RSS,positive,0.948315978050232
2026-07-22 23:05:00,Tesla Earnings Miss Despite Strong EV Sales; Elon Musk Preaches Robotaxi Caution - Investor's Business Daily,TSLA,Google RSS,negative,-0.7416743040084839
2026-07-21 21:27:00,Here’s How Much Traders See Tesla Stock Moving After Earnings - Investopedia,TSLA,Google RSS,neutral,0.0
2026-07-21 19:27:00,"Tesla (TSLA) Q2 2026 earnings preview: strong deliveries, murky profits - Electrek",TSLA,Google RSS,positive,0.3873491585254669
2026-07-21 15:09:05,Tesla stock gains as options traders price in ~6% post-earnings swing (TSLA:NASDAQ) - Seeking Alpha,TSLA,Google RSS,positive,0.9310383200645448
2026-07-22 08:09:08,"Tesla enters earnings with shorts piling in, technicals weakening: S3 Partners (TSLA:NASDAQ) - Seeking Alpha",TSLA,Google RSS,positive,0.862269937992096
2026-07-22 23:17:36,"S&P 500, Nasdaq close lower ahead of technology earnings",TSLA,Yahoo RSS,negative,-0.946113109588623
2026-07-22 23:05:11,Tesla Earnings Miss Despite Strong EV Sales; Elon Musk Preaches Robotaxi Caution,TSLA,Yahoo RSS,negative,-0.9250357151031494
2026-07-22 14:10:47,Meta stock may move 7.9% on July 29 earnings report - Investing.com,META,Google RSS,neutral,0.0
2026-07-17 13:17:00,Netflix stock hits a 52-week low after earnings—but analysts say investors are missing the bigger picture - Fortune,NFLX,Google RSS,negative,-0.9493022561073304
2026-07-22 18:17:00,Netflix stock analysis: No technical bottom yet despite solid fundamentals - Investing.com,NFLX,Google RSS,neutral,0.0
2026-07-16 16:31:00,Here’s How Much Traders See Netflix Stock Moving After Earnings - Investopedia,NFLX,Google RSS,neutral,0.0
2026-07-17 13:35:27,Netflix shares slide on disappointing growth forecasts - Financial Times,NFLX,Google RSS,negative,-0.9563596248626708
2026-07-17 20:44:00,Netflix stock plunges to 52-week low following mixed earnings report - Los Angeles Times,NFLX,Google RSS,negative,-0.9494255781173706
2026-07-19 09:00:00,Netflix stock plunges to 52-week low following mixed earnings report - Jefferson City News Tribune,NFLX,Google RSS,negative,-0.9320164918899536
2026-07-17 03:44:13,Netflix stock falls over 8% after disappointing earnings forecast - In Business Madison,NFLX,Google RSS,negative,-0.9727985262870787
2026-07-19 10:25:01,Netflix stock tumbles as weak outlook fuels investor doubts - MSN,NFLX,Google RSS,negative,-0.9530088901519777
2026-07-20 09:47:00,BofA trims Netflix stock target while betting on a rebound,NFLX,Bing RSS,positive,0.5435605645179749
2026-07-23 01:28:38,"US stock futures edge higher; Tesla, Alphabet dip after Q2 earnings - Investing.com",GOOGL,Google RSS,negative,-0.9010369181632996
2026-07-23 00:49:27,"[US Stock After-Hours Trading] Alphabet A fell nearly 3% in after-hours trading, as it raised its full-year capital expenditure outlook and the CFO stated that investment expansion will continue. Tesla declined after earnings, dropping nearly 4% in after- - Moomoo",GOOGL,Google RSS,negative,-0.9740374088287354
2026-07-22 11:08:48,"Stock market futures slide ahead of Alphabet, Tesla earnings - eciks.org",GOOGL,Google RSS,negative,-0.7682177424430847
2026-07-22 16:59:00,Why we're sticking with Alphabet despite an imperfect quarter and more AI spending,GOOGL,Bing RSS,neutral,0.0
2026-07-22 11:58:00,"CapEx Is in Focus for Microsoft Stock Ahead of Q4 Earnings, But the Bull Case Remains Strong",MSFT,Bing RSS,neutral,0.0
2026-07-23 02:35:00,Donald Trump's Iran Blockade Announcement Sent Oil Prices Surging and the Dow Falling,NVDA,Yahoo RSS,negative,-0.7855755090713501
2026-07-23 02:12:05,Analysts Say This Robotics Stock Could Be One of 2026’s Biggest Industrial Winners,NVDA,Yahoo RSS,neutral,0.0
2026-07-23 01:28:38,"US stock futures edge higher; Tesla, Alphabet dip after Q2 earnings - Investing.com",TSLA,Google RSS,negative,-0.9010369181632996
2026-07-23 07:04:51,Wolfe Research reiterates Alphabet stock rating on cloud gains - Investing.com,GOOGL,Google RSS,neutral,0.0
2026-07-23 06:47:04,US Stock futures slip as investors eye more earnings; Alphabet falls on higher capex outlook - صحيفة مال,GOOGL,Google RSS,negative,-0.9534101486206056
2026-07-21 21:30:02,Morgan Stanley Analysts Say Sentiment Has Gotten ‘Too Negative’ on Software Stocks. These Are Their Picks - Investopedia,MSFT,Google RSS,negative,-0.5337127447128296
2026-07-22 09:58:14,Prediction: Nvidia Stock Will Jump Higher After August Earnings - The Globe and Mail,NVDA,Google RSS,positive,0.9282369017601012
2026-07-23 06:25:00,2 Exceptional Growth Stocks That Are Great Buys In 2026,NVDA,Yahoo RSS,neutral,0.0
2026-07-21 15:28:02,Tesla stock surges around 4% ahead of earnings: what to expect? - TradingView,TSLA,Google RSS,neutral,0.0
2026-07-23 09:53:00,Alphabet Stock Is Falling as AI Spending Continues to Mount,AAPL,Yahoo RSS,negative,-0.973176121711731
2026-07-23 07:43:09,"US stock futures drop, tech set for more losses on Tesla, Alphabet - Investing.com",GOOGL,Google RSS,negative,-0.8795260190963745
2026-07-23 01:31:00,Alphabet Stock Is Falling as AI Spending Continues to Mount,GOOGL,Bing RSS,negative,-0.973176121711731
2026-07-23 08:36:08,Google Stock Slides Toward Third Red Day As Capex Surge Drowns Out Cloud Growth Story: Retail’s Buying The Dip,GOOGL,Yahoo RSS,negative,-0.7447450160980225
2026-07-23 08:27:00,Fed Chair Kevin Warsh Just Threw Cold Water on Investors Who Thought the Worst of Inflation Was Over,NVDA,Yahoo RSS,negative,-0.7761824131011963
2026-07-23 07:43:09,"US stock futures drop, tech set for more losses on Tesla, Alphabet - Investing.com",TSLA,Google RSS,negative,-0.8795260190963745
2026-07-23 09:53:00,Alphabet Stock Is Falling as AI Spending Continues to Mount,META,Yahoo RSS,negative,-0.973176121711731
2026-07-21 11:25:07,"‘It’s a Miserable Stretch,’ Says Top Investor About Netflix Stock - TipRanks",NFLX,Google RSS,negative,-0.9465451836586
2026-07-23 11:02:00,"Stock Market Today: Dow, S&P 500 and Nasdaq set to fall as Alphabet and Tesla results reignite fears over spending - MarketWatch",GOOGL,Google RSS,negative,-0.9649764895439148
2026-07-23 09:32:11,"UBS cuts Alphabet stock price target on capex, hiring concerns - Investing.com",GOOGL,Google RSS,negative,-0.4968621432781219
2026-07-23 11:05:15,"Alphabet stock falls after Q2 earnings beat, capex guidance surge - eciks.org",GOOGL,Google RSS,neutral,0.0
2026-07-23 11:11:30,"1 Number Every Investor Needs to Look For When Nvidia, Alphabet, and Amazon Report Earnings, Whether You Own the Stocks or Not - The Motley Fool",GOOGL,Google RSS,neutral,0.0
2026-07-23 05:13:00,"Dow Jones| Nasdaq | S&P 500 | US Stock Market Today | Live: US stock futures ease as Big Tech earnings rekindle AI spending worries, oil jumps",GOOGL,Bing RSS,positive,0.5089476108551025
2026-07-23 12:06:53,"Dow Jones Futures Fall As Oil Prices Top $90; Google, Tesla Skid On Earnings, Capital Spending",GOOGL,Yahoo RSS,negative,-0.9616050720214844
2026-07-23 12:00:42,"Oil prices hit 7-week high, Dow futures drop 340 points",GOOGL,Yahoo RSS,negative,-0.8712502121925354
2026-07-23 11:19:00,"Google’s AI Spending, Rising Oil Prices Spell Trouble for Stocks",GOOGL,Yahoo RSS,negative,-0.9500163197517396
2026-07-23 11:03:00,"1 Number Every Investor Needs to Look For When Nvidia, Alphabet, and Amazon Report Earnings, Whether You Own the Stocks or Not",GOOGL,Yahoo RSS,neutral,0.0
2026-07-23 11:11:30,"1 Number Every Investor Needs to Look For When Nvidia, Alphabet, and Amazon Report Earnings, Whether You Own the Stocks or Not - The Motley Fool",AMZN,Google RSS,neutral,0.0
2026-07-23 11:19:00,"Google’s AI Spending, Rising Oil Prices Spell Trouble for Stocks",AMZN,Yahoo RSS,negative,-0.9500163197517396
2026-07-23 11:03:00,"1 Number Every Investor Needs to Look For When Nvidia, Alphabet, and Amazon Report Earnings, Whether You Own the Stocks or Not",AMZN,Yahoo RSS,neutral,0.0
2026-07-23 12:01:00,Knox Systems Partners with Microsoft to Accelerate Secure Government Access to Commercial Innovation on Microsoft Azure,MSFT,Yahoo RSS,positive,0.8742169141769409
2026-07-23 11:19:00,"Google’s AI Spending, Rising Oil Prices Spell Trouble for Stocks",MSFT,Yahoo RSS,negative,-0.9500163197517396
2026-07-23 10:50:34,NVIDIA Corp (NASDAQ:NVDA) is a Quality Stock with a 125% ROIC and Strong Growth Profile - ChartMill,NVDA,Google RSS,positive,0.706002414226532
2026-07-20 18:50:01,"‘Hitting a Limit,’ Says Investor About Nvidia Stock — And It Doesn’t Look Good - TipRanks",NVDA,Google RSS,neutral,0.0
2026-07-23 11:11:30,"1 Number Every Investor Needs to Look For When Nvidia, Alphabet, and Amazon Report Earnings, Whether You Own the Stocks or Not - The Motley Fool",NVDA,Google RSS,neutral,0.0
2026-07-23 11:54:40,"Here Are Thursday’s Top Wall Street Analyst Research Calls: AT&T, Applied Digital, Autodesk, Duke Energy, Exxon Mobil, JPMorgan Chase & Company, Live Nation Entertainment, and More",NVDA,Yahoo RSS,neutral,0.0
2026-07-23 11:03:00,"1 Number Every Investor Needs to Look For When Nvidia, Alphabet, and Amazon Report Earnings, Whether You Own the Stocks or Not",NVDA,Yahoo RSS,neutral,0.0
2026-07-23 10:42:40,Tesla shares fall 6% in premarket as S&P 500 futures slide ahead of earnings - Crypto Briefing,TSLA,Google RSS,negative,-0.9609347581863404
2026-07-23 00:12:21,Tesla drops 5% after earnings miss on softer automotive margins - Investing.com,TSLA,Google RSS,negative,-0.9669841527938844
2026-07-23 12:06:53,"Dow Jones Futures Fall As Oil Prices Top $90; Google, Tesla Skid On Earnings, Capital Spending",TSLA,Yahoo RSS,negative,-0.9616050720214844
2026-07-23 12:00:42,"Oil prices hit 7-week high, Dow futures drop 340 points",TSLA,Yahoo RSS,negative,-0.8712502121925354
2026-07-23 11:19:00,"Google’s AI Spending, Rising Oil Prices Spell Trouble for Stocks",TSLA,Yahoo RSS,negative,-0.9500163197517396
2026-07-23 10:30:43,Tesla shares fall after earnings miss despite record deliveries and AI investment (NASDAQ:TSLA),TSLA,Yahoo RSS,negative,-0.9691770076751708
2026-07-23 11:19:00,"Google’s AI Spending, Rising Oil Prices Spell Trouble for Stocks",META,Yahoo RSS,negative,-0.9500163197517396
2026-07-23 10:34:01,"Analysts Are Bullish on Top Communication Services Stocks: Netflix (NFLX), Gray Television (GTN) - The Globe and Mail",NFLX,Google RSS,neutral,0.0
2026-07-23 00:23:00,Why we're sticking with Alphabet despite an imperfect quarter and more AI spending - CNBC,GOOGL,Google RSS,neutral,0.0
2026-07-23 14:06:31,"Alphabet Inc. (GOOGL.US) hit by simultaneous stock and bond sell-off! AI spending fears crush share price, while its 'century bond' drops below 90% of par value. - Moomoo",GOOGL,Google RSS,negative,-0.9598512053489685
2026-07-23 14:10:54,"Brent oil tops $100 per barrel, as Tesla and Alphabet drag Wall Street lower - WOODTV.com",GOOGL,Google RSS,negative,-0.7810782194137573
2026-07-23 14:34:51,"Oil tops $100 US per barrel, as Tesla and Alphabet drag stocks lower - CBC",GOOGL,Google RSS,negative,-0.9136890172958374
2026-07-23 13:46:00,"Brent oil's price briefly tops $100 per barrel, as Tesla and Alphabet drag Wall Street lower - Spectrum News",GOOGL,Google RSS,negative,-0.8707686066627502
2026-07-23 14:02:10,DA Davidson cuts Alphabet stock price target on higher capex outlook - Investing.com,GOOGL,Google RSS,neutral,0.0
2026-07-23 01:27:22,"Stocks slide at the open as oil prices surge, Alphabet & Tesla fall after earnings - Investing.com",GOOGL,Google RSS,negative,-0.949264645576477
2026-07-23 12:54:00,"U.S. Stocks May Come Under Pressure Amid Negative Reaction To Alphabet, Tesla Earnings - RTTNews",GOOGL,Google RSS,negative,-0.9216580390930176
2026-07-22 18:29:00,15 Billion Reasons Alphabet Shares Are Sinking After Reporting Strong Earnings Growth,GOOGL,Bing RSS,negative,-0.9606502056121826
2026-07-23 06:34:34,"Stock market today: Major indexes fall as Alphabet, Tesla shares drop, oil hits $100 a barrel",GOOGL,Bing RSS,negative,-0.9701684713363647
2026-07-23 14:42:09,Amazon stock may swing 6.4% on July 30 earnings report By Investing.com - Investing.com Nigeria,AMZN,Google RSS,negative,-0.9213899970054626
2026-07-23 13:41:12,"‘Both Sides of the Coin,’ Says Top Investor About Amazon Stock - TipRanks",AMZN,Google RSS,neutral,0.0
2026-07-23 14:40:00,Amazon stock may swing 6.4% on July 30 earnings report By Investing.com - Investing.com UK,AMZN,Google RSS,negative,-0.9142031073570251
2026-07-23 13:40:19,Microsoft Stock Sits 11% Below Its 200-Day Average as Earnings Approach - Benzinga,MSFT,Google RSS,negative,-0.9731624722480774
2026-07-23 12:45:43,Microsoft: Strong Buy Despite The AI CapEx Problem (NASDAQ:MSFT) - Seeking Alpha,MSFT,Google RSS,positive,0.9462190866470337
2026-07-23 14:48:01,15 Billion Reasons Alphabet Shares Are Sinking After Reporting Strong Earnings Growth,NVDA,Yahoo RSS,negative,-0.9606502056121826
2026-07-23 14:10:42,"As Analysts Bet on Boeing Turnaround, Retail Investors Fixate on One Uncomfortable Fact",NVDA,Yahoo RSS,neutral,0.0
2026-07-23 12:06:00,"Dow Jones Futures Fall As Oil Prices Top $90; Google, Tesla Skid On Earnings, Capital Spending - Investor's Business Daily",TSLA,Google RSS,negative,-0.9245508313179016
2026-07-23 13:14:43,Here’s How Much Traders See Intel Stock Moving After Earnings - Investopedia,TSLA,Google RSS,neutral,0.0
2026-07-23 03:24:00,Tesla shares fall 6% in premarket as S&P 500 futures slide ahead of earnings,TSLA,Bing RSS,negative,-0.9659672379493713
2026-07-23 14:25:42,"Tesla’s $28B quarter fueled by record deliveries, Semi production ramp",TSLA,Yahoo RSS,positive,0.7481577396392822
2026-07-23 13:21:23,"Wall Street set for lower open as Alphabet and Tesla disappoint while oil prices climb: Dow Jones, S&P, Nasdaq, Futures",TSLA,Yahoo RSS,negative,-0.8631215691566467
2026-07-23 13:06:26,"Exchange-Traded Funds, Equity Futures Lower Pre-Bell Thursday Amid Major Tech Stocks Sell-Off",TSLA,Yahoo RSS,negative,-0.9519372582435608
2026-07-23 13:17:00,Virtuix Expects to Report Major Sales Growth Following Meta Launch; Announces First Quarter FY2027 Results Conference Call,META,Yahoo RSS,neutral,0.0
