date,headline,ticker,source,sentiment_label,compound
2026-03-17 11:24:40,Apple stock price forecast for 2040: Long-horizon outlook builds near $800 as ecosystem expansion drives growth - Traders Union,AAPL,Google RSS,positive,0.8934990763664246
2026-03-18 00:45:37,Assessing Apple (AAPL) Valuation As Tariffs Pressure Supply Chains And Growth Expectations - simplywall.st,AAPL,Google RSS,neutral,0.0
2026-03-18 18:08:19,How Investors May Respond To QUALCOMM (QCOM) $20 Billion Buyback And Higher Dividend,AAPL,Yahoo RSS,positive,0.6288161277770996
2026-03-18 17:24:38,Alphabet stock price holds gains at $311 as market digests cloud growth strategy - Traders Union,GOOGL,Google RSS,positive,0.7841709852218628
2026-03-18 14:45:33,Alphabet stock: Conflicting technical signals prompt sideways price action - Traders Union,GOOGL,Google RSS,negative,-0.907135248184204
2026-03-17 09:02:06,Flow Traders U.S. LLC Makes New $2.74 Million Investment in Alphabet Inc. $GOOG - MarketBeat,GOOGL,Google RSS,neutral,0.0
2026-03-18 12:09:14,"8 Key Items Shaping the Stock Market Wednesday: Fed, VIX, Amazon, Swarmer - TheStreet Pro",AMZN,Google RSS,neutral,0.0
2026-03-17 20:28:59,Amazon stock rebounds as AI outlook boosts AWS growth narrative - investingLive,AMZN,Google RSS,negative,-0.6639237999916077
2026-03-17 21:58:00,"Stock Market Today (LIVE): Stocks Buck Rising Oil Prices, Tesla Locks In on the Grid - The Motley Fool",AMZN,Google RSS,positive,0.6067171096801758
2026-03-18 14:11:29,Microsoft stock: Suspected OpenAI contract breach triggers renewed selling - Traders Union,MSFT,Google RSS,negative,-0.9549071192741394
2026-03-16 14:35:15,Microsoft stock price forecast: Bearish technicals persist as MSFT trades in $390 to $410 range - Traders Union,MSFT,Google RSS,negative,-0.8925279974937439
2026-03-17 08:49:43,"Fort Point Capital Partners LLC Sells 15,017 Shares of Microsoft Corporation $MSFT - MarketBeat",MSFT,Google RSS,neutral,0.0
2026-03-17 09:15:51,"Holocene Advisors LP Sells 282,246 Shares of Microsoft Corporation $MSFT - MarketBeat",MSFT,Google RSS,neutral,0.0
2026-03-18 14:30:00,"[Latest] Global Financial Close Software Market Size/Share Worth USD 18.5 Billion by 2034 at a 8.1% CAGR: Business Research Industry (Analysis, Outlook, Leaders, Report, Trends, Forecast, Segmentation, Growth, Growth Rate, Value)",MSFT,Yahoo RSS,neutral,0.0
2026-03-18 14:18:47,Nvidia Stock Forecast: Trending Strong Buy Among Analysts - TipRanks,NVDA,Google RSS,positive,0.9397191405296326
2026-03-16 20:18:00,"Nvidia Rises As GTC Show Starts, Tech Partner Sees Strong AI Demand. Is Nvidia A Buy Now? - Investor's Business Daily",NVDA,Google RSS,positive,0.7175378203392029
2026-03-18 11:30:01,"Micron rides memory price spike into earnings with stock up 62%, drubbing its tech peers - CNBC",NVDA,Google RSS,positive,0.9229277968406676
2026-03-18 13:20:20,Nvidia (NVDA) Stock Flat amid GTC 2026 — Why Top Analysts Are Still Bullish - TipRanks,NVDA,Google RSS,negative,-0.9540056586265564
2026-03-19 02:41:23,Dow Jones Futures: Oil Backs Off $100; Micron Skids Despite Blowout Earnings,NVDA,Yahoo RSS,negative,-0.9269424676895142
2026-03-16 11:50:19,Meta shares jump after Reuters report on plans for layoffs of 20% or more - Reuters,META,Google RSS,negative,-0.9245667457580566
2026-03-16 15:42:59,"Stocks making the biggest moves midday: Nvidia, Peloton, Meta, Dollar Tree & more - CNBC",META,Google RSS,neutral,0.0
2026-03-16 09:23:26,Meta stock gains on report of possible 20% workforce cuts to offset AI costs - Investing.com,META,Google RSS,negative,-0.8186579346656799
2026-03-17 22:06:30,Key Advisors CEO Eddie Ghabour on how AI sentiment is influencing the stock market - qz.com,META,Google RSS,neutral,0.0
2026-03-18 18:13:44,"Citi Sets $115 Price Target for Netflix Stock, Highlights 3 Key Growth Drivers - Analytics Insight",NFLX,Google RSS,neutral,0.0
2026-03-17 13:00:04,How to Boost Your Portfolio with Top Consumer Discretionary Stocks Set to Beat Earnings,NFLX,Yahoo RSS,positive,0.7319913506507874
2026-03-16 16:27:04,"Stocks making the biggest moves midday: Nvidia, Peloton, Meta, Dollar Tree & more",NVDA,CNBC Finance,neutral,0.0
2026-03-16 16:27:04,"Stocks making the biggest moves midday: Nvidia, Peloton, Meta, Dollar Tree & more",META,CNBC Finance,neutral,0.0
2026-03-16 07:01:00,"Nvidia's stock price is 'entirely out of sync' with its growth outlook, analyst says",NVDA,Bing RSS,negative,-0.9258983731269836
2026-03-18 19:40:42,"TSLA stock rises after-hours: Musk says Tesla, SpaceX still betting big on Nvidia ‘at scale’ despite own-chips push",TSLA,Bing RSS,positive,0.7339999079704285
2026-03-17 18:08:42,Analysts revise AI hyperscaler debt forecasts after Amazon bond sale,AMZN,Yahoo Global,neutral,0.0
2026-03-19 06:04:15,A Look At Palantir Technologies (PLTR) Valuation After Major U.S. Army Deal And New AI Partnerships,NVDA,Yahoo RSS,neutral,0.0
2026-03-17 17:12:02,Lemonade stock jumps after Morgan Stanley upgrades to Overweight on Tesla partnership (LMND:NYSE) - Seeking Alpha,TSLA,Google RSS,positive,0.8813275694847107
2026-03-19 09:03:47,Alphabet Inc. Class A stock climbs on first 2026 dividend and earnings beat amid AI surge - AD HOC NEWS,GOOGL,Google RSS,positive,0.9074125289916992
2026-03-16 06:15:00,The Best 4 Retail Stocks to Buy and Hold for Decades - The Motley Fool,AMZN,Google RSS,neutral,0.0
2026-03-19 09:33:20,"Dow Jones Futures Fall, Global Oil Prices Surge; Micron Skids Despite Blowout Earnings",NVDA,Yahoo RSS,negative,-0.9516898989677428
2026-03-19 09:29:14,Tesla stock dips 1.7% as Musk signals continued large-scale Nvidia chip buying - Traders Union,TSLA,Google RSS,negative,-0.9458643794059752
2026-03-19 02:25:00,"Stock Market Today (LIVE): Stocks Buck Rising Oil Prices, Tesla Locks In on the Grid",TSLA,Bing RSS,positive,0.7890666127204895
2026-03-19 10:43:05,Dow Jones Futures Fall As Global Oil Prices Jump; Micron Falls Despite Blowout Earnings,NVDA,Yahoo RSS,negative,-0.939123272895813
2026-03-19 10:53:00,"Soaring Oil Prices, Surging Inflation, Fed Rate Fears. It’s Déjà Vu for Markets.",TSLA,Yahoo RSS,negative,-0.9003057479858398
2026-03-19 12:38:56,"US applications for jobless benefits fall to 205,000 last week as layoffs remain historically low.",AMZN,Yahoo RSS,negative,-0.9721080660820008
2026-03-19 12:35:00,Here's What Falling Oil Prices Mean for These 3 Energy Stocks,NVDA,Yahoo RSS,neutral,0.0
2026-03-19 04:27:00,Tesla can grow EV deliveries in the first quarter. The stock is down.,TSLA,Bing RSS,negative,-0.9418447613716124
2026-03-19 01:21:18,"Micron Pulls An Nvidia? Stock Plunges Premarket Despite Stellar Report, Soaring U.S.-Iran Tensions Drag Chip Stocks - Stocktwits",NVDA,Google RSS,negative,-0.923568069934845
2026-03-19 13:10:00,Micron Earnings Were Exceptional. Why the Stock Is Falling Anyway.,NVDA,Yahoo RSS,negative,-0.6772356629371643
2026-03-19 14:10:00,Is Tesla Stock Headed for a Fall? AI Hype Is Masking 2 Years of Falling EV Sales. - Barron's,TSLA,Google RSS,negative,-0.950796365737915
2026-03-19 13:01:00,Is Tesla Stock Headed for a Fall? AI Hype Is Masking Two Years of Falling EV Sales.,TSLA,Yahoo RSS,negative,-0.9662060737609863
2026-03-19 14:10:35,Meta Platforms Stock Forecast: Trending Strong Buy by Analysts - TipRanks,META,Google RSS,positive,0.7096743583679199
