date,headline,ticker,source,sentiment_label,compound
2026-05-22 15:19:47,"Apple stock hits all-time high, reaching 311.18 USD - Investing.com",AAPL,Google RSS,neutral,0.0
2026-05-22 10:45:00,Prediction: Alphabet Will Join the $5 Trillion Club and the Dow Jones Industrial Average in June - The Motley Fool,GOOGL,Google RSS,neutral,0.0
2026-05-23 15:43:00,"Amazon, GE Vernova Lead 5 Stocks Near Buy Points In Strong Market - Investor's Business Daily",AMZN,Google RSS,positive,0.8368618488311768
2026-05-24 21:38:00,This Billionaire Dumped Cloud Stocks for These New AI Stocks. Should Investors Follow Suit?,AMZN,Yahoo RSS,neutral,0.0
2026-05-20 18:51:00,This Famous Investor Just Sold All Of His Alphabet Stock and Loaded Up On Microsoft Stock. Should You? - The Motley Fool,MSFT,Google RSS,neutral,0.0
2026-05-20 14:31:05,Microsoft stock holds steady as 23% earnings growth boosts outlook - Traders Union,MSFT,Google RSS,positive,0.9457637071609496
2026-05-24 06:30:00,Microsoft (MSFT): One of the Best Long-Term Stocks to Buy Now for High Returns,MSFT,Bing RSS,positive,0.7809590697288513
2026-05-21 20:33:00,"Stock Market Today: Dow Up 276 Points Despite Nvidia Fall; AI, Quantum Computing Stocks Jam (Live Coverage) - Investor's Business Daily",NVDA,Google RSS,neutral,0.0
2026-05-25 14:47:10,"Does a 2,400% dividend increase signal Nvidia stock’s growth prospects are slowing? - twelfthmagpie.com",NVDA,Google RSS,negative,-0.6102888584136963
2026-05-25 08:30:43,NVIDIA CORP (NASDAQ:NVDA) Stands Out as a Strong Growth Stock with a Good Technical Setup - ChartMill,NVDA,Google RSS,positive,0.9111457467079164
2026-05-25 21:10:00,"Dow Jones Futures Rise, Oil Prices Dive As Iran Deal Talks Continue; Trump Says No 'Rush' - Investor's Business Daily",TSLA,Google RSS,neutral,0.0
2026-05-25 10:13:03,"New Age Alpha Advisors LLC Purchases 6,931 Shares of Tesla, Inc. $TSLA - MarketBeat",TSLA,Google RSS,neutral,0.0
2026-05-24 21:42:52,"Dow Jones futures: Stock market rebounds to highs; Tesla, these five AI plays are at buy points - MSN",TSLA,Google RSS,neutral,0.0
2026-05-25 16:58:00,"Dow Jones futures rise, oil prices dive on Iran deal hopes; Tesla, 5 AI stocks near buy points",TSLA,Bing RSS,negative,-0.713241457939148
2026-05-24 17:19:55,Meta stock dips 6% YTD but analysts remain bullish on AI-driven growth potential. - Pluang,META,Google RSS,negative,-0.9226313829421996
2026-05-21 08:42:30,Is Netflix (NFLX) Ken Fisher’s Top Tech Pick on Ad Growth?,NFLX,Yahoo RSS,neutral,0.0
2026-05-19 12:05:28,"Stocks making the biggest moves premarket: Home Depot, Amer Sports, Blackstone, Alphabet & more",GOOGL,CNBC Finance,neutral,0.0
2026-05-26 02:14:13,"‘I Would Wait,’ Says Top Investor About Amazon Stock - TipRanks",AMZN,Google RSS,neutral,0.0
2026-05-26 04:00:00,YipitData Looks at Holistic Beauty and Supplements Driving Overall Market Growth,AMZN,Yahoo RSS,neutral,0.0
2026-05-19 17:02:02,3G Capital Exits Microsoft Stock in Major Portfolio Shift. MSFT Is Still One of the Best AI Plays Now. - Barchart.com,MSFT,Google RSS,neutral,0.0
2026-05-26 01:29:07,NVIDIA (NVDA) Faces Stock Decline Despite Strong Earnings - GuruFocus,NVDA,Google RSS,negative,-0.9694907665252686
2026-05-26 04:57:47,RACE Stock Slips: Ferrari's New EV Supercar Luce Fails To Impress Retail Traders,AAPL,Yahoo RSS,negative,-0.9638033509254456
2026-05-26 07:20:00,3 Blue Chip Dividend Stocks to Buy in June as the Dow Jones Industrial Average Turns 130,AMZN,Yahoo RSS,neutral,0.0
2026-05-26 07:20:00,3 Blue Chip Dividend Stocks to Buy in June as the Dow Jones Industrial Average Turns 130,NVDA,Yahoo RSS,neutral,0.0
2026-05-26 12:00:00,"Quantum Stocks Surge On U.S. Funding. Were Google, Microsoft, IonQ Snubbed? - Investor's Business Daily",MSFT,Google RSS,neutral,0.0
2026-05-26 16:33:10,Apple stock hits all-time high as analysts see AI-driven breakout - TradingView,AAPL,Google RSS,positive,0.601620078086853
2026-05-26 14:24:35,Micron stock surges as UBS triples price target on AI demand,AAPL,Yahoo RSS,positive,0.4536665380001068
2026-05-26 11:02:48,Strong corporate earnings may not be what they appear - Axios,GOOGL,Google RSS,positive,0.3969252407550812
2026-05-26 14:24:35,Micron stock surges as UBS triples price target on AI demand,GOOGL,Yahoo RSS,positive,0.4536665380001068
2026-05-26 16:47:49,Dow Hits Fresh Record High as Iran Easing Hopes Lift Stocks,AMZN,Yahoo RSS,positive,0.7686693668365479
2026-05-26 14:24:35,Micron stock surges as UBS triples price target on AI demand,AMZN,Yahoo RSS,positive,0.4536665380001068
2026-05-26 15:21:30,Microsoft stock price trading near $419 ahead of Fed decision week - eciks.org,MSFT,Google RSS,neutral,0.0
2026-05-26 14:24:35,Micron stock surges as UBS triples price target on AI demand,MSFT,Yahoo RSS,positive,0.4536665380001068
2026-05-26 14:12:33,Nvidia stock price climbs to $214-$218 range as AI demand drives growth - eciks.org,NVDA,Google RSS,neutral,0.0
2026-05-26 16:47:49,Dow Hits Fresh Record High as Iran Easing Hopes Lift Stocks,NVDA,Yahoo RSS,positive,0.7686693668365479
2026-05-26 11:17:21,TSLA stock trades near $430 as Tesla rallies 11.8% since latest earnings report - eciks.org,TSLA,Google RSS,positive,0.8732368350028992
2026-05-26 14:24:35,Micron stock surges as UBS triples price target on AI demand,TSLA,Yahoo RSS,positive,0.4536665380001068
2026-05-26 10:36:44,"Stocks Set to Open Higher as U.S.-Iran Peace Hopes Hold, PCE Inflation Data and Fed Speak Awaited",TSLA,Yahoo RSS,positive,0.7056068181991577
2026-05-26 14:24:35,Micron stock surges as UBS triples price target on AI demand,META,Yahoo RSS,positive,0.4536665380001068
2026-05-26 09:33:10,Apple stock hits all-time high as analysts see AI-driven breakout,AAPL,Bing RSS,positive,0.6955924034118652
2026-05-26 19:36:00,Microsoft Stock Blues Persist Despite Earnings Beat; Is Microsoft A Sell Now? - Investor's Business Daily,MSFT,Google RSS,neutral,0.0
2026-05-26 14:49:27,"‘Don’t Miss This Gift,’ Says Top Investor About Microsoft Stock - TipRanks",MSFT,Google RSS,neutral,0.0
2026-05-26 19:36:40,Microsoft Stock Blues Persist Despite Earnings Beat; Is Microsoft A Sell Now?,MSFT,Yahoo RSS,negative,-0.911747932434082
