date,headline,ticker,source,sentiment_label,compound
2026-02-28 10:00:33,Great Lakes Advisors LLC Decreases Stake in Apple Inc. $AAPL - MarketBeat,AAPL,Google RSS,negative,-0.6131405830383301
2026-02-26 18:45:00,Software Bear Market: Is the Amazon Dip a Once-in-a-Decade Buying Opportunity or a Falling Knife? - The Motley Fool,AMZN,Google RSS,neutral,0.0
2026-02-26 19:34:26,Software Bear Market: Is the Amazon Dip a Once-in-a-Decade Buying Opportunity or a Falling Knife? - The Globe and Mail,AMZN,Google RSS,neutral,0.0
2026-02-26 09:27:48,Amazon stock: AI spending sparks investor caution - Latest news from Azerbaijan,AMZN,Google RSS,neutral,0.0
2026-02-27 16:31:59,Microsoft Stock 2026 Forecast: MSFT Has a $600 Billion Backlog as Demand for Microsoft Cloud Surges - TipRanks,MSFT,Google RSS,negative,-0.9312226176261902
2026-02-25 01:07:00,Goldman Sachs resets Microsoft stock forecast - thestreet.com,MSFT,Google RSS,neutral,0.0
2026-02-24 20:50:00,Microsoft’s stock selloff is approaching a critical crossroads not seen in over 10 years - MarketWatch,MSFT,Google RSS,neutral,0.0
2026-02-23 14:30:34,"‘Look to History,’ Says Top Investor About Microsoft Stock - TipRanks",MSFT,Google RSS,neutral,0.0
2026-02-25 21:01:00,Microsoft stock price rebounds as Japan raids Azure unit; MSFT investors eye Nvidia earnings - TechStock²,MSFT,Google RSS,negative,-0.9385531544685364
2026-02-28 10:00:28,"Donaldson Capital Management LLC Purchases 2,172 Shares of Microsoft Corporation $MSFT - MarketBeat",MSFT,Google RSS,neutral,0.0
2026-02-26 13:00:37,Trifecta Capital Advisors LLC Raises Stock Position in Microsoft Corporation $MSFT - MarketBeat,MSFT,Google RSS,positive,0.8193615674972534
2026-02-24 21:07:00,Goldman Sachs resets Microsoft stock forecast,MSFT,Bing RSS,negative,-0.7481476068496704
2026-02-24 14:36:00,Microsoft’s stock selloff is approaching a critical crossroads not seen in over 10 years,MSFT,Bing RSS,negative,-0.6441550254821777
2026-02-27 14:34:28,Nvidia stock rises after $78 billion earnings forecast - qz.com,NVDA,Google RSS,neutral,0.0
2026-02-26 22:29:00,Nvidia Stock Drops Despite Bullish Q4 Report. AI Angst Blamed. - Investor's Business Daily,NVDA,Google RSS,negative,-0.9363390207290648
2026-02-26 15:36:00,Why Nvidia’s stock is falling despite a historic earnings beat - MarketWatch,NVDA,Google RSS,negative,-0.8932204246520996
2026-02-27 16:04:00,Stock Market Can't Hold Key Levels Amid AI Concerns; Nvidia Tumbles Despite Strong Earnings: Weekly Review - Investor's Business Daily,NVDA,Google RSS,negative,-0.895270049571991
2026-02-26 18:43:46,Goldman Sachs explains Nvidia stock decline despite strong results - Investing.com,NVDA,Google RSS,negative,-0.9399569034576416
2026-02-26 13:05:00,"Dow Jones Futures Rise; Nvidia Climbs In Buy Zone After Strong Earnings, Guidance - Investor's Business Daily",NVDA,Google RSS,positive,0.8761585354804993
2026-02-26 08:10:32,The worst day for Nvidia's stock since last spring drags Wall Street lower - KSAT,NVDA,Google RSS,negative,-0.9684464931488036
2026-02-24 19:35:23,Morgan Stanley resets Nvidia stock forecast ahead of earnings - thestreet.com,NVDA,Google RSS,neutral,0.0
2026-02-26 22:05:55,The worst day for Nvidia’s stock since last spring drags Wall Street lower - Los Angeles Times,NVDA,Google RSS,negative,-0.9568790197372437
2026-02-26 21:34:40,Worst day for Nvidia's stock since last spring drags Wall Street lower - Toledo Blade,NVDA,Google RSS,negative,-0.966374695301056
2026-02-26 22:14:00,Nvidia stock falls despite strong earnings - Semafor,NVDA,Google RSS,negative,-0.9585533142089844
2026-02-25 15:35:00,Nvidia earnings recap: Stock rises after earnings blow past Wall Street estimates,NVDA,Bing RSS,positive,0.8701637387275696
2026-02-26 06:52:00,Nvidia's stock opens lower despite the upbeat report,NVDA,Bing RSS,negative,-0.964234173297882
2026-02-26 14:53:00,The worst day for Nvidia’s stock since last spring drags Wall Street lower,NVDA,Bing RSS,negative,-0.9559311866760254
2026-02-26 14:35:45,‘Getting Serious’: Top Investor Eyes a Potential Catalyst For Tesla Stock - TipRanks,TSLA,Google RSS,neutral,0.0
2026-02-24 16:19:00,"Billionaire Investor Stanley Druckenmiller Eliminated His Fund's Position in Meta Platforms and Piled into Another ""Magnificent Seven"" Stock That's Been Getting Crushed by the Broader Market - The Motley Fool",META,Google RSS,negative,-0.74824458360672
2026-02-25 10:29:18,"Meta stock on the verge of a brutal bear cycle, warns expert - Finbold",META,Google RSS,negative,-0.9076526165008544
2026-02-27 01:03:00,"WBD-Paramount Reactions: Wall Street Analysts Split, Activist Investor Celebrates & Netflix Stock Rises - Deadline",NFLX,Google RSS,negative,-0.8513922691345215
2026-02-27 01:08:22,"Wall Street posts worst month since March amid geopolitics, trade, and AI fears - Investing.com",NFLX,Google RSS,negative,-0.9264202117919922
2026-02-26 21:08:20,The worst day for Nvidia's stock since last spring drags Wall Street lower - The Albertan,NVDA,Google RSS,negative,-0.9645203351974488
2026-02-26 10:14:08,The worst day for Nvidia’s stock since last spring drags Wall Street lower - AccessWDUN,NVDA,Google RSS,negative,-0.9628587365150452
2026-02-25 02:41:00,"Meta stock on the verge of a brutal bear cycle, warns expert",META,Bing RSS,negative,-0.925889790058136
2026-02-24 08:22:00,"Billionaire Investor Stanley Druckenmiller Eliminated His Fund's Position in Meta Platforms and Piled into Another ""Magnificent Seven"" Stock That's Been Getting Crushed by the ...",META,Bing RSS,negative,-0.8353114724159241
2026-02-26 10:01:14,"Foundations Investment Advisors LLC Buys 9,704 Shares of Microsoft Corporation $MSFT - MarketBeat",MSFT,Google RSS,neutral,0.0
2026-02-26 22:51:27,The worst day for Nvidia's stock since last spring drags Wall Street lower - Northeast Mississippi Daily Journal,NVDA,Google RSS,negative,-0.9584762454032898
2026-02-26 14:05:55,The worst day for Nvidia's stock since last spring drags Wall Street lower,NVDA,Bing RSS,negative,-0.958816647529602
2026-03-01 11:07:20,Apple’s Houston Manufacturing Push Ties AI Servers To Supply Resilience,AAPL,Yahoo RSS,positive,0.9038112759590148
2026-03-01 12:58:46,"TFB Advisors LLC Sells 6,864 Shares of Microsoft Corporation $MSFT - MarketBeat",MSFT,Google RSS,neutral,0.0
2026-03-01 12:47:39,"February jobs data, Broadcom earnings, and AI fears abound: What to watch this week",NVDA,Yahoo RSS,neutral,0.0
2026-03-01 12:25:00,"Got $3,000? 3 Top Growth Stocks to Buy That Could Double Your Money",NVDA,Yahoo RSS,neutral,0.0
